review,rating,date,language,restaurant
"I ate at Con Gracia when visiting Barcelona & it was one of the best dining experiences I've had. For my sister's birthday I got her a voucher here, and she also loved it. 
I emailed with Sabrina to set up the voucher and she...was responsive & respectful the entire time. Would recommend.More",50,September 2022,COM,Con Gracia
"My first ever visit to Barcelona, and as part of a business meeting, I met two colleagues from the UK.  This restaurant was booked due to its great reviews.

I have to say that this was was one of the, if not the best ever...meal I have had. From the start, the lovely hostess was friendly, there when you needed but just let us get on with our business meal. The quality of the food was amazing and the wine match was just superb.

If you are in Barcelona and looking for an amazing event for dinner, DO go to this restaurant.. It is AMAZING.

I could go on for ages, but simply go… I hope I get the chance to return here one day.. Thank you so muchMore",50,November 2022,COM,Con Gracia
"We made a reservation at the recommendation of a friend and were ""wow""d by the food, atmosphere, and personal attention. The food was spectacular with attention to every taste and combination. Every course was served with precision, and the settings and style were world class....It was a phenomenal experience!!

The owner served us and he was considerate, personable, and passionate about food and the total experience. When it Barcelona, this is an experience worth doing!!More",50,November 2022,COM,Con Gracia
"Yesterday I visited Con Gracia restaurant for the second time.  I took all my daughters there to have an extraordinary experience that I told them about in the past.  if you want to taste something captivating and like to listen to the story behind each...course, this restaurant is the right place for you.More",50,October 2022,COM,Con Gracia
"From the moment we arrived we were treated as if we were very special, the food wine and service were one of the best that we’ve ever had we had the tasting menu with wine pairing and I would recommend this to anyone who decides...to visit Can Grassia we certainly look forward to returning hopefully sometime in the future, special thanks to Serena for the wonderful information and service, thank you all at Can Grassia kitchen as well .More",50,October 2022,COM,Con Gracia
"There are few dining experiences that can truly be called “perfect,” but our dinner at Con Gracia was most certainly one of them. Con Gracia offers a selection of tasting menus from which we chose the surprise menu- chefs choice- and were we in for...a treat. Each course offered perfectly balanced flavor, texture and color. The hosts treat every guest like good friends creating a warm and delightful atmosphere. The total experience was simply perfect.More",50,October 2022,COM,Con Gracia
"This restaurant does everything right.  It started with good communication prior to arriving to confirm the reservation and check on any food allergies/dislikes. The restaurant is on a quiet street away from crowds, but very easy to get to. When we arrived early for our...reservation we were greeting warmly by Jose and taken to our table after only a short wait. 

The food was well-prepared, beautifully presented, and delicious.  Each course came with a short explanation on what we were about to eat.  Both Jose and Sabrina were fabulous! One of us got the wine pairings and those were excellent as well.  

In short, make a reservation and EAT HERE... you won't regret it.More",50,October 2022,COM,Con Gracia
"I love the restaurants with the surprise menu. They are always fun and you try different things. The staff was great, Jose greeted us and from that moment all was perfect. The choice of wine (we chose a bottle but you can do pairing if...you wish) and food was top notch. I highly recommend you make a reservation in advance and enjoy. 
Thank you for the wonderful evening. 
Maja and BrankoMore",50,October 2022,COM,Con Gracia
"We loved Con Gracia for three things in particular: the divine food, with creative combinations and excellent presentation, the wine pairings, highlighting the best flavors and minerality of wines from the Catalan region and elsewhere in the E.U., and above all, the service.  Jose and...Sabrina were such an engaging duo, offering just the right amount of intelligence about the food and wine. Cheers to the artistry of the chef and kitchen staff. We would recommend Con Gracia to everyone.More",50,September 2022,COM,Con Gracia
Wow ! A wonderful dining  experience. 3 separate degustation menus available. Each 5 course. One is a surprise from the chef when he teases you into guessing ingredients and flavours. Wine pairings are bang on - from low volume local producers. All dishes are extremely...well presented- art on a plate. A great combination of flavours and textures. A short cab ride from Central hotels. It really is worth making  that journey.More,50,September 2022,COM,Con Gracia
"We went to this restaurant based on good ranking in TripAdvisor and we certainly were not disappointed. 
We both chose the surprise menu and my wife also tried the wine pairing.
All the dishes were interesting, original, and delicious ( all portions were small, but...adequate to appreciate the presentation and flavors and sufficiently satisfying).
The atmosphere is quite intimate, with only a few tables in the dining area.
José was an excellent host and he was even kind enough to leave the restaurant premises to find us a cab to get us back to our place.
Would go back. Highly recommended.More",50,September 2022,COM,Con Gracia
"This is a special place and experience. We had an unforgettable meal here . I have gluten issues and they made sure my entire tasting was free of gluten. Also they baked me fresh bread that I could enjoy. Sabrina was a gem and took...care of us so beautifully.
The blind tasting is a must. Every bite was perfection. 
My wine pairing was also an incredible experience. I would recommend this to anyone going to Barcelona, with thousands of places to eat, this is the best !More",50,September 2022,COM,Con Gracia
Lovely fresh tasting and interesting Latin American food. Lively atmosphere and friendly staff. Enjoyed the cocktails too! Highly recommend it!,50,February 2023,COM,Kiltro Restobar
"Overall it is a nice place with very friendly staff, but my food was not very enjoyable. My quesadillas were fried so hard they were brownish (who even fries quesadillas this days??) and fish tacos had a not pleasant taste. Food could be better. Drinks...and people are great.More",30,February 2023,COM,Kiltro Restobar
"Super good food, excellent pisco’s en nice vibe. Would reccomend everyone to visit Kiltro if you visit or live in barcelona",50,February 2023,COM,Kiltro Restobar
You know that place that you go and never want to go out of it! This is that place. Delicious food great cocktails and even better people that run the place! So we will visit this place when ever we are in Barcelona!,50,January 2023,COM,Kiltro Restobar
"Incredible staff, great atmosphere and top food choices. Really welcoming and helpful, great place to have dinner with friends. Would definitely recommend",50,December 2022,COM,Kiltro Restobar
"Excellent service and environment! The people are extremely nice and the food is absolutely awesome. The Picanha is wonderful and all the entrances yucas, empanadas, patacones are super recommended.",50,December 2022,COM,Kiltro Restobar
"I’ve returned to Kiltro about 3 times already, they serve delicious Latin food that has a modern and interesting touch. The cocktails are also amazing (the Pisco Sour verities are my favorite) and the service is friendly and welcoming.  
Don’t give it a second thought,...it’s also good value for money.More",50,December 2022,COM,Kiltro Restobar
Delicious food. Cocktails very nice. Lovely environment people very helpful and friendly. Highly recommend,50,November 2022,COM,Kiltro Restobar
"In this restaurant, I felt like we were in Mexico!
Excellent Mexican dishes, very tasty.
The prices were reasonable the service was Professional!",50,October 2022,COM,Kiltro Restobar
Me and my significant other really enjoyed this Mexican food spot. It was my first Mexican cuisine in Barcelona and I’m glad it started on a high note. Appetizers are great and entrees just as good.,50,October 2022,COM,Kiltro Restobar
"My partner and I booked a table at KILTRO Restobar based on the great reviews. Well, they did not disappoint. When my partner and I were unsure and indecisive on what to order, we received som really good recommendations from our server. The food was...great and so were the cocktails. The staff are really knowledgeable, quick and all round awesome and very service minded. The restaurant has a welcoming and chill atmosphere. I would recommend a visit to KILTRO when visiting Barcelona.More",50,September 2022,COM,Kiltro Restobar
"We had an amazing meal at Kiltro. Everything was good value and the service was excellent. However, we did find it odd that we were asked if we wanted any other drinks or food, to which we said yes, before being told we actually had...to leave because the next booking was there - slightly odd.More",50,September 2022,COM,Kiltro Restobar
"Went to KILTRO with some friends for a night of catching up and having some food. Very much surprised by the night. The food is spot on, Admosphere is great and the hosts are just incredible: they seem born with a passion for making your...night. Ask them about the tequila, any detail of the food or the michellada.. You ll love the response!More",50,August 2022,COM,Kiltro Restobar
"Great food, excellent service, cozy and party vibe at the same time! A must in Barcelona if your looking for a spot for dinner and drinks :)",50,August 2022,COM,Kiltro Restobar
"Amazing food and great service! The best restaurant in Barcelona!! Go here to enjoy the good food, cocktails and the vibe!",50,August 2022,COM,Kiltro Restobar
Very  good restaurant and good meat. The waiter Angel was very helpful and friendly.  Worth a visit to try the awesome parillas,40,February 2023,COM,Don Asador
"Small, unassuming restaurant, which I picked based on excellent reviews and didn't disappoint. I booked through a website which offered a 30% discount code which was a bonus, but to be honest the food is worth paying full price! I would recommend pre-booking simply because...it was packed even on a Tuesday night, and isn't a massive restaurant. 

When we arrived the service was friendly and personal, and continued that way the whole meal. I felt like they were genuinely delighted to have us there which makes the experience so much better!

We ordered mixed meats, grilled vegetables and one portion of fries. This was more than enough for two of us, it might even stretch to three! The vegetables selection was cooked beautifully, but the meat. WOW, some of the most delicious steak and other meats I'd ever eaten. The steak was so tender and great quality. 

We had food left over and as we were staying in self catering accommodation they parcelled it up and I took it home. The next day I had a steak sandwich, and the meat actually tasted even better than the day before! 

The toilet is accessible, and everything is on one level. They were welcoming of young families too. One of the best meals I've ever had.More",50,April 2022,COM,Don Asador
"You could not find a nicer staff of people. Elias was wonderful and friendly - the food was excellent, a perfect final meal to my vacation. It’s been a while since I had a great steak.",50,February 2023,COM,Don Asador
Food is very good but not sure why they take table bookings and make you wait outside for 50 mins and let walk ins go before you. Organisation of the tables and bookings is a bit of a mess. Tables that are reserved should be...priority over people just turning to for food. Thanks xMore,40,February 2023,COM,Don Asador
Tasty food and delicious cocktails! Cosy setting and amazing service. Whole family made to feel welcome by friendly staff.,50,February 2023,COM,Don Asador
"We had a great meal here, the food was delicious and the wait staff (Yvette and Lyn) were so friendly and kind to our small children! We would definitely come back.",50,February 2023,COM,Don Asador
Perfect stake! Elias the best service in the world totaly recomended the food was good aswell but Elias is number 1 in Spain Elias,50,February 2023,COM,Don Asador
"Excellent service, good location, perfect feeling, value for money. The best food ever, Amazing service by Iliya. Everything was erfect",50,February 2023,COM,Don Asador
The food was amazing and the service from Yness and Ibeth was amazing. Recommend! We will definitely come back!!!!!!!!!,50,February 2023,COM,Don Asador
"We had the flank steak with French fries. The steak was very large and comes with good dips ( e.g. chimichurri) on the side. Our favorite were  the French fries! We also liked the digestive shot we got free of charge. The staff is very...friendly and attentive. We can recommend Don Asador :)
The only thing we did not like were the men coming inside trying to sell roses. The restaurant staff should send them back outside.More",50,February 2023,COM,Don Asador
Very good restaurant nice service we come back ! The food was tasty the meat was perfect we had a great time everyone loved it,50,February 2023,COM,Don Asador
Very nice place with a warm catalan ambient. Food was very good and the wine is excellent. All the people was very friendly and helpful especially Yness.,50,February 2023,COM,Don Asador
"The food was delicious and so was the wine. 
Very nice staff. Special thanks to Iness for atending us so well.",50,February 2023,COM,Don Asador
"Excellent food, we had wine and short ribs, and excellent service by Yness 😊 we had a baby with us and they were very accommodating",50,February 2023,COM,Don Asador
"We were recommended this restaurant and before we arrived in Barcelona, we tried to reserve a table for a group of 6 twice by sending  them emails, no reply....SHAME!",20,February 2023,COM,Don Asador
"Great little restaurant with friendly, helpful staff and a nice atmosphere. We had the large tasting menu, and all the starters were great. The salmon tartar and the Locavore egg were outstanding - imaginatively presented, fresh and tasty.

Wasn't so impressed by the main courses....The turbot was dry with small bones in it, and it had quite a solid texture, maybe a bit over-cooked, the skin was jelly like and, not sure about the beef stock. The venison ribs were OK, just not special. 

Dessert was a big disappointment. The tiramisu was dry and tasteless, probably the worst tiramisu I've ever had. The cream dessert was OK, a bit heavy. All in all we had a good evening and enjoyed our meal, just a few of the dishes let it down.More",40,February 2023,COM,Locavore Barcelona
A fabulous restaurant with great service and marvelous food—very inventive and creative dishes but quite filling. Can’t say enough great things about this place!,50,November 2022,COM,Locavore Barcelona
"Very nice place, splendid working team in kitchen and waiters. Enjoyed the meal finding out new tastes and textures.
Great recommendation . We’ll come back",50,July 2022,COM,Locavore Barcelona
"I took my girlfriend for her birthday for dinner. I contacted them through WhatsApp and they were very helpful in setting the table up with flowers and a candle. The food was amazing, all of the plates we tried were delicious and the attention from...the waiters was perfect. They explained in detail how each dish was prepared, and made sure everything was okay for us.

Absolutely no complaints at all. I would 100% recommend this place. It was a perfect experience for us.

https://www.tripadvisor.com/ShowUserReviews-g187497-d23545654-r839815196-Locavore_Barcelona-Barcelona_Catalonia.html#More",50,May 2022,COM,Locavore Barcelona
Amazing meal and wonder service. Attentive and relaxed. Difficult to choose between the long and short menu. But the short was wonderful. A great mix of nationalities dining and the staff were fluent in languages. A fun and delicious dining experience in the heart of...Barcelona!More,50,April 2022,COM,Locavore Barcelona
"50e for a couple in a nice setting including a decent bottle of wine.  The food was good, bordering on excellent.  The fake risotto is a must try, the cod was also great, potato emulsion with Iberia crisp… great.  The duck magret was not the...highlight, it was a little chewy and needed salt.  The service was also good, though not excellent.  Overall a good place.More",40,April 2022,COM,Locavore Barcelona
"Fantastic restaurant! Some of the best food I have ever eaten! I wish I could remember the name of the guy who was our waiter, his English was perfect and he explained every dish so clearly! Wish we had found it sooner as I wanted...to go back the next day and eat it all again..More",50,April 2022,COM,Locavore Barcelona
"Lovely Evening!

When we first arrived, we were struggling a bit with the menu as it was all in Spanish. However, the staff were very friendly and helped us a lot. We went for the large set menu (7 dishes and a bottle of wine)...which was great value and all the food was delicious!
Everything was great, you won’t leave hungry! 
Perhaps an English Menu would be beneficial, but staff were very helpful.More",50,March 2022,COM,Locavore Barcelona
"Great food, great service, great value. A little gem that was recommended to us and I would pass that recommendation on.",50,March 2022,COM,Locavore Barcelona
"The chef at this lovely restaurant is an absolute gem, with many years of experience under his belt; working in many different countries. He is extremely talented and creative! You aren't just eating food; It is a whole experience...it is truly art. I was seriously...blown away. And of course the service was delightful; the staff are very knowledgeable in all the beautiful ingredients that in the dishes they are bringing out. If you are visiting Barcelona, you must visit Locavore!More",50,February 2022,COM,Locavore Barcelona
"We went there hoping to discover local products during the whole meal but were a bit disappointed... I guess they try to use local products in their plates (though the ""foie mi cuit"" cooked with Coca Cola does not seem very aligned with that philosophy),...and the food was good. 
What was more disturbing was that when I asked for a soft drink, I was only suggested a Fanta or a Nestea... A pity when so many more local and healthier alternatives exist. At least the water was from the tap, hence local ;) 
Service was also a bit weird: e.g. we received an entrance (offered by the restaurant, which is nice) 2 minutes before our plate, which didn't leave us enough time to eat it!
In conclusion, a good restaurant with a concept only half exploited.More",30,November 2021,COM,Locavore Barcelona
"Had a wonderful dinner with a very international group of friends, and everyone's tastes were satisfied!
The menu offers a great number of different and interesting dishes.
I personally loved the ready-made menu option, as a bottle of wine was included in the price, will...surely visit again next time I'm in Barcelona!More",50,September 2021,COM,Locavore Barcelona
Came with my girlfriend and she said it tastes just like her Nona’s cooking. Phenomenal food and very welcoming staff. A must visit,50,January 2023,COM,Off-Street
Excellent pizza with high quality Italian ingredients. The staff is very lovely! Highly recommend!!!,50,December 2022,COM,Off-Street
We came to Barcelona because we saw this was the best spot. We were not surprised when we met Leonardo who was very welcoming and funny. He was very kind and understanding of my vegan needs. The atmosphere was great and the choice of beers...was very good. We really enjoyed our stay and we will be coming back! Pizza Pasta Better!!More,50,November 2022,COM,Off-Street
"Best Italian food in Barcelona. Great food, nice space and very friendly employees. 
A restaurant to return for sure.",50,November 2022,COM,Off-Street
Super cozy and well attended by all the staff really cautious and welcoming. We were 6 and all felt really good. Worth the visit.,50,November 2022,COM,Off-Street
"If you love Italian food, definitely come here.
Perfect for pizza and pasta.  fantastic
Come quickly and eat. Feel it.",50,November 2022,COM,Off-Street
Carbonara spaghetti is the best place in Barcelona. The pizza is so delicious! The staff's service is also the best!!,50,November 2022,COM,Off-Street
"The food was fantastic, fresh, and hot. I ordered a calzone and it was delicious. Staff was super nice too.",50,November 2022,COM,Off-Street
"Our best Italian yet here in Barcelona, thoroughly enjoyed ourselves. Both the food and service was great. Will 100% be back",50,November 2022,COM,Off-Street
"We had Italian wood fired pizza for lunch. It was so delicious and very well priced. If you’re a tourist visiting Hospital de Sant Pau, search for it. You won’t be disappointed. We highly recommend if you’re looking for authentic Italian food.",50,November 2022,COM,Off-Street
"Absolutely awesome place! Food delicious, service excellent, location absolutely romantic…
Would definitely return and eat here.",50,October 2022,COM,Off-Street
"We booked a table of 7 for a birthday. Warm and welcoming staff, stunning food. They did everything to make our night special. 10/10",50,October 2022,COM,Off-Street
"Top quality food 
Amazing customer service 
Great place to enjoy a real Italian food with family or friends.",50,October 2022,COM,Off-Street
"Cozy pizza place, but with other dishes as well. All 3 generations of family were happy with their meal. Nice vibe and open on Sundays",50,August 2022,COM,Off-Street
"Our waitress shook her head and laughed as my wife and I tried to explain we don't speak Spanish. We managed to order some very nice pizza via pointing and very weak Spanish. An older man working there spoke poor English but enough to tell...us a bit about himself and the beer selection which was small but had some quite good drafts. We got a flight of his recommendation and were very happy with it. We finished with some pistachio desert that was unlike anything I've ever eaten before a strange sort of pudding maybe, it was tast.More",50,June 2022,COM,Off-Street
"I tried this restaurant with a friend, it’s very small but extremely good! The sushi is very well done and tastes amazing! The staff and chefs are so polite and kind, the service is 11/10.

I strongly recommend going here to have the best sushi...in Barcelona!More",50,February 2023,COM,Jara Sushi Degustación
"Best sushi we’ve ever had, the most amazing experience with the chef preparing in front of you. All the staff were excellent a special mention to willam, Nicolas and Robbie for the brilliant service! Definitely a must when you visit Barcelona and will definitely be...back.More",50,January 2023,COM,Jara Sushi Degustación
"the sushi is amazing. the presentation is amazing. the space is intimate and the staff are genuine - you can tell they love what they do and really make an effort to give you the best experience possible. totally recommend going, as well as taking...the sushi they recommend. ask for furano (if not already offered) after eating - an experience i would not be without. Nicolas and the chef were so so kind.More",50,February 2023,COM,Jara Sushi Degustación
"This japanese resto. is awesome!!! Very high quality fish... the japanese rice is perfect and the service is wow!  unbeatable... all nice and friendly, will be back for sure with friends.",50,December 2022,COM,Jara Sushi Degustación
"It was freezing in there. Did not enjoy their choice for a loud hiphop music. Did not love that they had no green tea (unheard of for a Japanese restaurant to not have a hot tea). Did not like that the place was so uncomfortable,...could not wait to leave. Thought WTF with all the stellar reviews? Made me think: what? really? Nevertheless, the servers were nice, friendly. Hope your experience is better than mine. -pMore",10,December 2022,COM,Jara Sushi Degustación
"One of the reviews said next level sushi and that is definitely an accurate description! There is one table and about 5 bar seats available in the whole place so we reserved the table. There were 3 of us and we each got the 70EUpp...tasting menu. Every bit was so fresh and unbelievable. The only weird thing is I think they close at 4:00 and took us at 3:30(I didn’t know they closed at 4:00 until we got there). We probably would have ordered more food but one of the chefs rushed out and it just seemed like they wanted to close down which made it difficult to relax. They could not have been any friendlier. The place could not have been any cleaner. If you are used to eating a ton of sushi I could see the tasting maybe not being enough but it was plenty for me. One other difficult thing was the language barrier so just be aware of that if your Spanish isn’t great. But I honestly cannot say enough about this place, such a cool little experience.More",50,November 2022,COM,Jara Sushi Degustación
"Amazing sushi, on another level. Extremely nice wagyu meat (not that expensive though). Primary focus is take-away but had a really fun night",50,November 2022,COM,Jara Sushi Degustación
Amazing sushis - wow. Service was awesome too and the chef was a masterpiece to watch. Highly recommend!,50,November 2022,COM,Jara Sushi Degustación
Lovely Japanese restaurant great quality of fresh fish. It's a very little place so very cosy. Extremely beautifully presented and lovely service. Only thing we were disappointed with was that they had ran out of prawns and crab but all what we had was delicious....I could eat Japanese food all day.More,40,October 2022,COM,Jara Sushi Degustación
