review,rating,date,language,restaurant
"We have had a few meals this week at nice restaurants in Spain and Scotland.   A couple ranked higher than Viana in Barcelona on TripAdvisor,  a Michelin Bib Gourmand suggestion in Barcelona, a 1 star Michelin restaurant in Edinburgh.   We both agree, Viana exceeded our...expectations.   
We had the suggested red wine, the marinated salmon for a shared plate, and each an Argentine steak.  Everything was fantastic.  
The food was perfect,  but more than that, the service was so friendly.   Greeted immediately,  welcomed to Viana, super friendly,  but not overbearing staff.  
I mean...an absolute delight.  Less than 100 euros for a bottle of wine, a shared plate (+ a free delicious pumpkin/cheese appetizer), and terrific steaks.  Truly underrated restaurant.   
We have one more meal next week that isn't reserved yet...and we'll probably go back to Viana!More",50,November 2022,COM,Viana
"Visited mid week when there was no wait for a table. Weekends can have a queue. 
The food and service were amazing. The omelette especially was a great choice. The service was fast and friendly. The coffee is also worth a mention. Very good.",50,February 2023,COM,Billy Brunch & Garden
"The staff were incredibly friendly and food was delicious, a good portion and not overpriced. The garden was a lovely place to have lunch and would recommend to anyone in Barcelona!!!!",50,February 2023,COM,Billy Brunch & Garden
"This place is perfect for pure goodness and comfort food in a super chilled out setting. I’d eat here everyday 😬 check the menus out it’s a place that makes your belly and soul a happy place. 

The staff were all really helpful, service was...fast … it’s a place that I would share with anyone going to Barcelona it’s that goodMore",50,February 2023,COM,Billy Brunch & Garden
"Great busy atmosphere with lovely hygge interior. A delicious brunch menu for great value, served all day with very friendly service. Tip: arrive early to take advantage of the garden area which would be amazing in the sun.",50,February 2023,COM,Billy Brunch & Garden
This place was the highlight of my trip and was a great start to the day. The staff were incredibly kind and offered great customer service. The food was fresh and felt locally sourced a.k.a. the chickens that they keep for the eggs. We chose...to sit outside and were asked if we would like the heater on which was a great addition. They had a café cat that room to the outside area and was extremely friendly to visitors. I cannot recommend this place enough and it was so affordable.More,50,February 2023,COM,Billy Brunch & Garden
"Had the best time here. Did have a queue but it went fast and had regular updates. All the staff were so friendly, including the chefs who all said hello when you came in. The garden area was lovely, really pretty and in the sun....The food was delicious - I had the pancakes which were so nice and my boyfriend had the full English which he said was great. Good value for what you get about £8-£12 for ours. Definitely worth the hype and the wait.More",50,February 2023,COM,Billy Brunch & Garden
"Just totally recommend this brunch. The staff is kind, friendly and helpful. Also the food is amazing. If you wanna join a delicious brunch in a cute space with a good vibes environment, this is your place!🥰",50,January 2023,COM,Billy Brunch & Garden
"1. Very cozy and “instagramish” place. 
2. The food was great! Right amount of everything: taste, spice, portion, beauty
3. The guys there are super friendly and work great 

Probably it’s better to make a reservation - there is always a line. Although I don’t...know if they have a reservation option. 
It was a great experience.More",50,January 2023,COM,Billy Brunch & Garden
"Outstanding !
We came across this wonderful place unexpectedly and thought we’d give it a try.  

What wonderful staff, food & place this is. 
The second we walked in the door every member of staff said hello to us and were super friendly ! 

We...sat outside in their lovely little garden and it was so beautiful and cozy. There was even chickens & a super friendly local cat that all members of staff knew (she was very cute !).

Our food was outstanding & the coffee was the best! So much to choose from on the menu. 

We are so so glad we found this place! If we are ever  back in Barcelona we will be back!More",50,January 2023,COM,Billy Brunch & Garden
"Greet branch, we waited a bit before outside, the omelette and the scrambled eggs was great, the pancakes was a bit heavy and it seemed that they wanted us to leave fast because other people were waiting outside even though we weren’t sitting there for...more then 1 hour, but the waitresses were kind.More",30,December 2022,COM,Billy Brunch & Garden
"No doubt is a right place to go for have some breakdast or brunch . Cozy and friendly atmosphere , kind and attend personal , creamy latte or any fresh tasty coffee and rich flavored food . The prices is so loyal and not exaggerated....Love to start my day from here .More",50,December 2022,COM,Billy Brunch & Garden
"Everytime I rush through Barca for a business trip, Billy Brunch has become my go-to breakfast place! 

The portions of food are very generous for the price paid, each BB venue is different and unique while keeping a common theme to the brand, the staff...is international, smiling and always willing to help. What more can one desire?

I highly recommend a visit, and wonder what your experience of it will be 😄More",50,December 2022,COM,Billy Brunch & Garden
"We had this on our list of breakfast options for the trip so spent our Sunday morning queuing for what we’d read would be a 4.9 treat! 

After a 30 minute queue, we were greeted by the chefs and most of the staff before being...seated inside. ( Definitely opt for outside if you can. Very pretty garden ) The service was 10/10 throughout but sadly the food did not live up to our expectations. I ordered scrambled eggs and they were very dry/ over cooked and my friend had the shakshuka which is usually her favourite breakfast meal, but she only managed to eat her eggs and the piece of baguette she was given, avoiding the sauce which resembled more of a stew. 

We’re both really not that fussy, especially with breakfast, but we left most of it untouched. The staff were v kind and apologetic and we left without a bill.

Such a shame as was really looking forward to it! Great service, great ambience but the food was very average!More",30,October 2022,COM,Billy Brunch & Garden
"My favorite brunch in whole Barcelona. Would recommend a lot Chakcuka plate. Besides, the coffee is amazing",50,October 2022,COM,Billy Brunch & Garden
Great athmosphere and energetic friendly staff and delicious food. Seems very popular and we had to wait 5 min in line but totally worth it,50,October 2022,COM,Billy Brunch & Garden
Really great food at a fair price. Excellent homemade pasta and pinsa (pizza). We visited twice and would definitely visit again. The lasagna and bolognesa was loved by the kids. Really friendly staff and quick serving.,50,February 2023,COM,Paisano Bistro
"I keep going back to Paisano. The food is incredibly tasty, homemade, high-quality ingredients and the family who owns the place always go the extra mile. In the menu you will find something for every taste. I always recommend this place to my friends when...they ask where they can go eat Italian (I'm Italian) and Paisano never disappoints :) 

Per gli italiani: fidatevi, andateci!!More",50,February 2023,COM,Paisano Bistro
"Small tiny place that seems to be always full but very good pinsa available for you. in general it is better to book the place in advance, otherwise you wait quite a while",50,February 2023,COM,Paisano Bistro
The food here was very fresh with good flavor. It's a family run restaurant.  We had one pizza and one pasta dish. Servings are large enough to share.,50,January 2023,COM,Paisano Bistro
"Walked in, no reservation but felt welcome.

Food was really nice, as was wine, service very friendly. Would recommend. Great for families.",50,December 2022,COM,Paisano Bistro
The cups are dirty the food is so horrible I don’t unterstand the reviews here. DONT GO THERE BAD BAD FOOD,10,December 2022,COM,Paisano Bistro
"My wife, 4 year old, and I had a wonderful lunch here. The home made pasta was great and the my son enjoyed the margarita pizza.",50,December 2022,COM,Paisano Bistro
Great service and food. I highly recommend homade octopus burger and tiramisu with pistachio 🤤🤤🤤 5* from me ❤️,50,November 2022,COM,Paisano Bistro
"We had a lovely meal and a little bit of trip planning time while enjoying a bottle of cava. Thank you Nicolai, you made our stay extra special.",50,November 2022,COM,Paisano Bistro
The most delicious lunch!! I had the best gluten free crust pizza of my life with burrata and tomatoes. It was the perfect texture while still being crispy on the bottom. And my partner enjoyed his regular crust as well. We will definitely be back...here to try the pasta!!More,50,November 2022,COM,Paisano Bistro
"Very nice lunch after visiting Sagrada Familia. Friendly staff and informal atmosphere. Authentic food and appealing, rustic interior. A gem amongst a lot of mediocre places in the immediate area.",50,November 2022,COM,Paisano Bistro
"When you go to see Sagrada Familia, make sure to reserve a table here at this gem. This family run italian bistro has the BEST pizza and house-made pasta in Barcelona. The mozzarella is made special and the tiramisu creamy. Seriously, do not miss eating...here.More",50,September 2022,COM,Paisano Bistro
"If you are looking for authentic Italian cuisine, then this is the place where you should go!
Professional servers",50,October 2022,COM,Paisano Bistro
"The place is very cozy, the decore is amazing such an authentic place … it’s a family run business, with the best Italian flavor, really an outstanding place among others in the area. Very nice service (they speak English, Spanish and Italian) so it’s nice...for everyone in the globe.More",50,September 2022,COM,Paisano Bistro
"We live in the area but only now had dinner here and we're definitely going back again and again. The food is so amazing, it's absolutely fantastic. The products they use are incredibly high quality, especially the burrata is incredibly tasty.
The service could be...a bit more attentive and personal but it's still good.More",50,September 2022,COM,Paisano Bistro
"I almost never write restaurant reviews, but we met a waiter there who had to be recognized publicly. Salva was his name and he was phenomenal. He catered to the two children in the group. He was prompt, smart, caring, and knowledgable about the food...and wine. And he just had this friendly demeanor about him that made us all happy. By the end of our dinner, two of us said, ""He's the best waiter we've ever had in Barcelona"". Good wine, good starters, carbonara inside a Roman cheese, gastronomic history, truffle pizza, a nutella pizza with pear, and to finish a limonchelo to digest. We couldn't ask for more. Thank you!More",50,February 2023,COM,Gusto
"Food was to die for! The pizza and the pasta were perfectly made the Italian way, lovely place and people 💜🇪🇸",50,July 2022,COM,Gusto
"Food is amazing. There is a big variety of pastas and pizzas, also have nice meet. Very friendly service.",50,February 2023,COM,Gusto
"Lovely and timely service, amazing food and great portions. especially recommend the carbonara !!!!!",50,February 2023,COM,Gusto
"This is one of the best restaurants I’ve ever been into Barcelona, the services is outstanding and the food are the next best thing, I strongly recommend this place for a romantic dinner or if you want to experience truly Italian food",50,February 2023,COM,Gusto
"Amazing Italian restaurant with Italian owner, really kind man made us feel like home. Typical Italian dishes that will make you feel as if you are in Italy. I had the Parmigiana di melanzane which was the best that I have tasted in Barcelona and...tastes totally the same as in Italy, a Spaghetti Carbonara which was served in a big Pecorino wheel with fresh Truffle and as dessert a home made Tiramisu. Also the style of the restaurant is lovely. l would 100% recommend this restaurant.More",50,February 2023,COM,Gusto
"Dinner was great. We had spaghetti carbonara that came on the cheese, and was very tasty. Everything overall was great. Agui, our waiter was amazing. We’ll definitely come back.",50,January 2023,COM,Gusto
"Service: perfect. Very professional

Local: clean, tables are near ones from the others

Meals: really italian ones

Menu: very complete and varied

Price: working days menu (17,9 €), a bit high (from my point of view). If you go to have dinner, you only have...the option to choose from the all menu (la carta en español).More",50,January 2023,COM,Gusto
"I booked this restaurant a number of weeks for New Year's Eve.
On the day whilst attending a football game in Camp Nou  I received an email at 14.30pm to say my table was cancelled.
When I phoned to ask why I was told they...were closing at 18.00.
As a result of the late cancellation we couldn't get a booking in another restaurant as others were either fully booked or closed.
Very unprofessionalMore",10,December 2022,COM,Gusto
"One of the best meals we had in Barcelona! Delicuous pizza, pasta and our son loved his steak frites. And our waiter, Agui, took great care of us. Highly recommend!",50,December 2022,COM,Gusto
"One of the best Italian pizzas in Barcelona, in a wood fire oven.
A part from traditional pastas and pizzas, great more elaborated and sophisticated Italian dishes, for example, several dishes with truffle in season.",50,January 2023,COM,Gusto
"The service was very good, Claudio (Agui) was very friendly and helpful. The ambience is cozy and it felt very warm! A place to return to.",50,January 2023,COM,Gusto
"We arrived at the restaurant and was seated at 9pm (our reservation time), and get this, the paella didn’t arrive until 10:15. I ordered a fried tempura shrimp dish as my children were quite hungry at that time. The waiter got our order wrong and...took a quite combative tone with me when I pointed out on the menu what I had ordered.

We waited and waited for the paella, and I wanted to order a second order of the shrimp because again, very hungry after waiting for so long. The waiter was rude and flat out told me no with hand gesture. I had to get another waitress to get my order in. Overall,  the service was rushed and incredibly slow. The waiter was rude and aggressive.  When I received the bill, there were wrong items (things I didn’t order). 

The shrimp and paella— as late as it was—was delicious. Kudos to the chef!More",10,December 2022,COM,Gusto
The pasta had an amazing taste and perfectly al dente like you wish you could cook your pasta. You can’t go wrong for this price!,50,December 2022,COM,Gusto
"The food was delicious, very authentic. Our waiter, Agui, was very kind and attentive. I had the Calzone with Ricotta, and the tiramisu and it was delicious, all my colleagues were happy with their choices too",50,December 2022,COM,Gusto
"What a great experience we had! Definitely we can say that this is the best brunch restaurant in Barcelona. Food is very, very tasty, ambient is cool and they have a terrace at the quiet square. We will come back.",50,February 2023,COM,Cremat 11
"Wow! Great pancakes and such a different take on using pancakes in a brunch! 
I had the special of the day (“the King” if I remember correctly) which was an Eggs Benedict with bacon and crab, and my wife had the Eggs Benedict (served with...the pancakes vs a traditional biscuit or English muffin). 
It was delicious! If I had it to do over I think I would have opted for the smoked salmon version (personal preference), although it doesn’t have bacon in it. 
It’s different to not have a pancake without syrup and the fixins, but they are light and taste so good. They’re thicker than what I had expected, but oh so good. 
My wife’s comment: “these are great!”
We would have gone back again and again if we had more time in the city and didn’t want to try other places. 
When we return to Barcelona, Cremat 11 will be the first brunch we enjoy!!More",50,February 2023,COM,Cremat 11
"I paid 15 euro for sausage and eggs and i had to leave most of it. For the quality and amount this should cost 6 euro max.

I waited 30 minutes to get in and left hungryMore",20,February 2023,COM,Cremat 11
This place is an amazing find and so worth seeking out. We have had some amazing breakfasts in Barcelona but this might be my favourite. Not only is the food delicious but it is also beautiful. Great service and vibe to this wonderful little place...tooMore,50,February 2023,COM,Cremat 11
"We had the American Breakfast and Eggs Royale with pancakes. 
I am really picky about poached eggs but they were cooked to perfection. 
The pancakes were homemade. Everything tasted delicious. 
Wish we’d found this restaurant on day 1",50,February 2023,COM,Cremat 11
"Beautiful food- tried the american breakfast, cheeseburger & banana pancakes. Beautiful breakfast and good price too. Very pretty cocktails- and strong! Will be coming back and recommend to everyone.",50,February 2023,COM,Cremat 11
"Delicious food and drinks. Staff were very friendly and considerate of the extremely long wait. However there was limited seating, interesting toilets and a few things on the menu were not available. But a spot I would recommend never the less.",40,February 2023,COM,Cremat 11
"Everything was delicious and great value. Josh, who served us was brilliant and helpful. Best experience eating this whole trip.",50,February 2023,COM,Cremat 11
We were expecting some lovely pancakes but instead got the best pancakes we ever ate! They were so fluffy and yummy. Would recommend to everyone 🤩,50,February 2023,COM,Cremat 11
Really like the foods and joyful place. I eat  here every time I come to Barcelona. Gracias tambièn a George.,50,February 2023,COM,Cremat 11
"Had an excellent solo stop in a quiet outdoor square after a morning in the picasso museum.  Had a crab benedict hybrid with light fluffy pancakes that was excellent.  And, of course,a vermouth.  Great and fast service.  Recommended.",50,February 2023,COM,Cremat 11
"I had the best unexpected brunch here! I was walking around and just decided to pop in because I was hungry, and I was in for such a pleasant surprise. Not only was the interior cozy and gorgeous, but the food, drinks, and staff were...all amazing too! I had the best blueberry mojito ever and the Pancakes Benedict, which was absolutely delicious. This meal was amazing and I will definitely be bringing friends and family here!More",50,January 2023,COM,Cremat 11
"Great brunch at Cremate. We had the Eggs Benedict with smoked salmon. It’s a very small place but the fresh squeezed Mimosa”s, good food, quick service and fun vibe made it worth the wait. We waited about 10 min at noon in January on a...Saturday. Others waited longer. The pancakes looked amazing and the have a very wide variety of them.More",50,January 2023,COM,Cremat 11
"The environment is really cosy and hip. It’s a small venue, so quite intimate and the food & drinks are amazing! We had the waygu cheese burger and the pancakes benedict, along with some cocktails and white sangria!",50,January 2023,COM,Cremat 11
"This place is fab! We came for breakfast and we’re blown away by their pancakes! So many options to choose from , sweet & savoury!
Staff were wonderful, George served us who was very helpful ! 

Thank you very much !",50,January 2023,COM,Cremat 11
"Near Ecanta station, this was a small but absolutely wonderful restaurant. When we arrived we were unable to get our phone to work to get the menu up (by scanning the QR code). The gentleman running the place couldn't have been more helpful, getting his...own phone so we were able to look at the menu and order.

He was also very tolerant with my basic Spanish skills!

We ordered Patatas bravas for starters. My daughter pulled a face when I explained what it was, and the fact we had to try it while in Barcelona. That face soon changed to total delight when she declared the dish one of the tastiest things she'd ever eaten! We finished off our meal with a chicken and beef burger respectively. You could taste the ingredients were fresh and homemade, no mass produced chain restaurant quality here. 

I thought it was excellent value for money, with friendly and kind service.More",40,April 2022,COM,b Restaurant
"Really good burgers and nice team. What a surprise, did not expect to have such a good burger and not expensive. A must eat if you like a good burger",50,March 2022,COM,b Restaurant
Great burgers and friendly service. The burger was fresh and tasty and ingredients were great quality. Definitely one of the best - and most straightforward - restaurant in this part of town. I just wish it opened a little earlier.,50,February 2020,COM,b Restaurant
"Excellent food in a great atmosphere, anything you want in a burger, best burgers we’ve ever had.  Attentive and very pleasant staff, definitely worth a visit.",50,December 2019,COM,b Restaurant
"We were missing B Burger, but then realized that B Restaurant is the SAME just bigger and in other location.
Burgers are AMAZING!!! Without doubt the best ones in Barcelona. Also the fries and desserts! The staff is so friendly and good prices.
Totally recommended!!!",50,January 2019,COM,b Restaurant
"We were a group of 6 friends (3 couples) in our 30s catching up after the summer vacations. We were greated at the door by Marc, one of the owners and the heart and soul of the renowned ""b Burger"" and also the newer ""b...Restaurant"". 

The restaurant atmosphere is really welcoming. They showcase a great craft beer selection that they know well so you can ask for recommendations if in doubt. We had some patatas bravas to start with and they were to die for; not only because the sauce was a truly homemade ""brava"" sauce but because the potatoes themselves were cooked to perfection by Chef Albert, the other owner. 

As a main course I had the b-Dali, an awesome 150 g meat patty with foie and confit onion cooked exactly as I requested. My friends tried the b-Pol, b-Mozart and b-Dolce Vita and they were all amazed by the quality of all the ingredients and the meticulous presentation and plating. We ended the meal with their homemade white chocolate cheesecake that was the perfect last touch for a memorable dinner. 

None of us was vegan or vegetarian but they offer a nice selection of vegan burgers and many garden-to-table options that makes the ""b Restaurant"" really friendly for people with dietary requirements. 

The location of the ""b Restaurant"" is perfect as it's just 5 minutes walk from the central Sants Estació train station and it's also just beside the ""Entença"" stop of the blue underground line (L5). The neighbourhood is relaxed but centric at the same time. This is a great choice if you want to go out after dinner or if you want to linger at the table just chilling.More",50,September 2018,COM,b Restaurant
Very good food! Extremely clean restaurant with a friendly atmosphere! Very helpful and kind stuff! Totally proposed!!!,50,August 2018,COM,b Restaurant
"Such a good experience!  My friends and I went to Barcelona a few days and we found this place, excellent attention, better food ( even has vegan options!)  
 The best part of all the desserts!  We tried a few of them and we agreed red...velvet is the best!  
 And totally affordable,  everyone has to come and try out!More",50,January 2018,COM,b Restaurant
Great experience with friends!! Amazing place to enjoy a fantastic piece of meat!! I will be back soon!!,50,February 2018,COM,b Restaurant
Fantastic authentic Spanish tapas meal. Really great service and atmosphere. The waiter even gave us a free plate of food to try on the house and shots at the end of the meal. Great prices and atmosphere. Would 100% recommend. (Some spanish speaking would be...helpful but we didn’t know a word and still managed to communicate everything we wanted!)More,50,February 2023,COM,Bar Xapako
"Delicious tapas and such a friendly atmosphere! We loved our meal here, from the anchovies to the padron peppers and all the charcuterie in between. My 15 year old is conducting a survey of every jamon croquette in Barcelona; these are the best. Even with...a bottle of cava and multiple rounds of soft drinks for the kids, this was surprisingly inexpensive.  Listen to the owner’s recommendation- the Russian salad was delicious!More",50,February 2023,COM,Bar Xapako
Best Tapas Bar in Barcelona. The owner couple is amazing and very lovely. I highly recommend everybody who is coming to Barcelona to visit this bar. The food is very tasty. There are many options of drinks.More,50,February 2023,COM,Bar Xapako
"Excellent place for tapas and drinks.
Tipical tapas bar for local people. 
The owner will suggest You the plates if You want.",50,January 2023,COM,Bar Xapako
"Nope.

I actually spent a lot of time trying to construct a cclever review that would honestly sum up my  ""meal"" at this ""restaurant"". But this one word is honestly more than enough. Nope.More",10,January 2023,COM,Bar Xapako
"Food was dreadful. Service was slow and maybe because the owner wasn’t there but apart from the sausages everything was mediocre to bad. Burger patty was over cooked, weird smelling sweet sauce inside.More",20,January 2023,COM,Bar Xapako
