review,rating,date,language,restaurant
"The Faire restaurant in Barcelona offers a delightful brunch experience that has something for everyone… who loves vegetarian food. From savory dishes like eggs Benedict, to sweet treats like cheesecakes and fruitbowls. you are sure to find something to satisfy your appetite.

The atmosphere is...both relaxed and inviting, and the staff is friendly and helpful. The decor is modern and stylish yet cozy, with plenty of comfortable seating. 
The food is of excellent quality and expertly prepared. The eggs Benedict that I had, is exceptionally tasty and cooked to perfection. The crepes are also delicious, with a variety of savory and sweet fillings to choose from. 
The drinks selection is also impressive. I am a kombucha fan, so I was happy with my tasteful rosemary, mint, lavender combination. 
Overall, the Faire is a great spot for brunch in Barcelona. The food is top-notch, the drinks are well-crafted, and the atmosphere is relaxed and inviting. Whether you're looking for a leisurely meal or a quick snack, the Faire is sure to please. And next to their customers, they’re also very earth friendly. So it’s a win-win for everyone!More",50,February 2023,COM,Faire Brunch & Drinks
"Enjoyed a delicious brunch here. Chose the ‘Popeye’. Essentially eggs on spinach, avocado on the side. Not easy to make spinach flavoursome but whoever cooked this knew what they were doing. Came with toast on the side. Not just any toast. This was the perfect...grainy wholemeal, toasted to crispy perfection. 
Had a cuppa tea too. Wanted ordinary….not available here! Assam in a test tube to infuse no less. Big bowl of it, on a saucer with various trimmings such as a bit of honey on the spoon with some lavender just in case I wanted to stir it in. Other options on the saucer were a white chocolate button and mint leaf and was that a bit of cinnamon? There was clearly an artist on duty. 
My charming waiter didn’t bat an eyelid  when I asked for a little bit of cold milk on the side. At that point I hadn’t realised quite what I’d ordered so at least I didn’t feel too Philistine-like. 
Then there is the decor……retro heaven. Menu QRs on cassettes/Sophia Loren’s cookery book/flat cap on a hat stand etc. Loved the lighting in particular. 
Just one thing, as per usual
in Barcelona as I was solo I was directed to the area opposite the bar to perch on a stool. Why is this?  I’m not a bird I don’t want to perch. My request for a table was accommodated v courteously though - as was the request by a fellow. I did feel a bit apprehensive that a larger group might come in though and that I may have to move. 
Maybe they knew what they were doing though….I may have ended up staying overnight….the music is fab! I defy anyone not to enjoy it. 
Maybe fewer large tables? Maybe start a campaign against directing solo eaters to perches? This place exudes too much classy perfection for that. 
And, just to hit this point home, every bill paid means a tree is planted! 
Love this place. Only open Thurs-Sun according to the website. Whaaat?!More",50,November 2021,COM,Faire Brunch & Drinks
"Friendly management, very good food, vegetarian, with vegan alternatives. You can plant a tree by choosing the right option in the menu. Also, great music and a real espresso.",50,February 2023,COM,Faire Brunch & Drinks
"The food was just amazing! We ordered the croissant Benedict’s and the pancakes. The staff is super friendly and the place looks great, super cozy!",50,February 2023,COM,Faire Brunch & Drinks
Two big avocado toasts with some salad plus decent size of green smoothie made the visit worthwhile!,50,February 2023,COM,Faire Brunch & Drinks
"I got a glowing recommendation to go here from a friend and I was thoroughly impressed with my experience. The atmosphere was cozy and inviting, with a mixture of vintage and modern décor and the service was warm and friendly. The menu offered a nice...selection of brunch favourites and I decided to go with the avocado toast and tofu scramble with a side salad. It was a generous portion, but the meal didn’t feel heavy, and it was all really fresh and tasty. I also tried an Upraising coffee with active mushrooms and nootropics. Everything was soooo good. Overall, I highly recommend this brunch spot. The food was excellent, the service was great, and the atmosphere was enjoyable. I will definitely be back for another brunch in the future.More",50,February 2023,COM,Faire Brunch & Drinks
Delicious healthy food. Super pretty and the waitress so lovely nice and good looking!:D I will come again.,50,January 2023,COM,Faire Brunch & Drinks
This place was so nice! I went for lunch and had the Avacado and beetroot toast it was amazing! Then I had a slice of vegan banana bread and that was also incredible could not tell it was vegan at all :)))) I would recommend...for lunch/brunch!!!More,50,January 2023,COM,Faire Brunch & Drinks
"This was the best brunch by far, fresh ingredients and amazing presentation! Will definitely visit again. 
Staff were super friendly and helpful.",50,January 2023,COM,Faire Brunch & Drinks
"Lovely location, food was delicious and the staff very friendly and all were speaking english! Didnt expect this to be so lovely, interior had a nice design and food came Fast and very tasty ! 
Would definetely recomend and would come again if ever in...barcelona again!More",50,December 2022,COM,Faire Brunch & Drinks
Amazing menu in a great decorated atmosphere and lovely music! You should definitely try avocado toast and delicious coffee that you may fall in love❣️,50,December 2022,COM,Faire Brunch & Drinks
Great hospitality and perfect taste... The presentation of the food was very good. Thanks a lot to the chef and the staff.,50,November 2022,COM,Faire Brunch & Drinks
"The place with the beautiful interior and delicious food, what is a really rare wonderful mix in the touristic cities! 

Amazing cozy atmosphere. Even in a rainy weather the mood here is inspirational and positive. Of course, thanks to the attentive, polite and professional staff!...Thank you!
Highly recommended!!

Can not add the photos of the dishes, as all of them were eat before the review;)More",50,November 2022,COM,Faire Brunch & Drinks
"This place has an amazing brunch! The service is fantastic, the owner and waiters are super friendly and kind! The food is tasty, also vegan options available!",50,November 2022,COM,Faire Brunch & Drinks
Perfect place perfect meals perfect staff best place i visited for brunch in barcelona. You should try vegan bacon it has the same taste,50,November 2022,COM,Faire Brunch & Drinks
"Very good food at a very good price and very kind seller. For those who are vegans, you can enter without a problem because they have options",50,February 2023,COM,"Tino, esto no es una pizzería"
"I love the concept of Tino. Not a pizza, not an empanada, not a burrito. Genius. I ordered 4 of them and they were all so good, but my favorite one was the Tacotino. Delicious. The Oreo mousse and the lemonade were so good too,...you can tell they're homemade. I loved it!More",50,February 2023,COM,"Tino, esto no es una pizzería"
Absolutely delicious food! Our favourite food that we have had in Barcelona. Really affordable too. We will be back!,50,November 2022,COM,"Tino, esto no es una pizzería"
"Accidentlaly stumbled upon this place and it was my lucky day I guess, because it is very tasty, great price, has many interesting options with super unique names that will give you a good laugh. Also the guys working there were fun to talk to....Definitely recommended !More",50,October 2022,COM,"Tino, esto no es una pizzería"
"No Reservations Pizza to the side of Sonny Bree's Bar, Strandhill, Sligo is by far the best pizza I've ever had in the whole of Ireland. Give yourself a culinary treat and try one.  They're quite special.",50,November 2022,COM,"Tino, esto no es una pizzería"
Great find for an afternoon lunch or evening snack. Freshly made with a variety of options. Much more than just a mini pizza!,50,September 2022,COM,"Tino, esto no es una pizzería"
I was meeting my friend so we can go walk our dogs. Having lunch somewhere with them sometimes can be a pain so I randomly found this gem on instagram and thought it'll be the perfect food to have. The portion is great to hold...while we walk the dogs and they were absolutely delicious too!More,50,September 2022,COM,"Tino, esto no es una pizzería"
"It was our last day in Barcelona and we were looking for a place to eat and we found the perfect one.
We chose this restaurant based on the reviews and we don’t regret it at all. 
We tried one of each type of tinos...they had and every single one of them totally worth it. 
My favorite one was the pesto chicken. 
This place is a “must to go” when you’re visiting Barcelona and definitely try all the tinos.More",50,August 2022,COM,"Tino, esto no es una pizzería"
"Thank you trip advisor for helping to find this place. It was quite far from our hotel but we are so glad we went out to this neighbourhood.

Good value, freshly made for us, piping hot and taste great. Our favourites were the Pulled fiction...& chicky pesto - prefect!! There are a few more options including vegan. Plus chilled beers in the fridge and if you need something sweet they sell cheesecakes in jars.

It’s a takeaway mostly, just a couple of stools whilst you wait for your order. Also there is a park area a few minutes walk away with several benches. 

They haven’t been open long and are clearly working really hard. We are going back to Barcelona soon and will definitely be returning to Tinos.More",50,August 2022,COM,"Tino, esto no es una pizzería"
"We visited Tino's based on Trip Advisor recommendations and were not disappointed!! The food was absolutely delicious, prepared quickly and we received really lovely service from the team. It's also excellent value for money. My partner and I had 4 each which was a great...lunch for us, and we would highly recommend you try them 😍 we may not have seen it had we not done the research, a hidden gem for sure!More",50,August 2022,COM,"Tino, esto no es una pizzería"
"I loved the Tinos thank you very much!! My favorite one is the Pulled Fiction.. the product is bery innovative, the packaging is perfect and they were all very delicious.
 100% recommend them for a fast bite and they are perfect to share",50,August 2022,COM,"Tino, esto no es una pizzería"
"Awesome concoction of flavours, every bite is to saviour.

I wanted a small bite to keep me going until dinner and came across Tino. It’s like a cross between a calzone and pizza. 

I had the chicky pesto, Tarantino, tacotino and pull fiction and each...one was superb. The Tarantino being my favourite. 

I didn’t think I’d eat them all but I couldn’t put them down. 

Great food!More",50,July 2022,COM,"Tino, esto no es una pizzería"
Thank you Tino for the amazing mini pizza with a very tasty filling and pleasant communication! Top place to eat in Barcelona 🙂 (Lemon cheesecake dessert is sooo delicious!),50,July 2022,COM,"Tino, esto no es una pizzería"
It was such a treat discovering Tino because I quickly found one of my favorite delicious food places in Barcelona. The staff is very friendly and helpful. The dough is handmade through the day and the tinos are served fresh out of the oven. I...would recommend trying more than one because you will definitely want more. I got the 4 pack and they were so tasty I ate all four! They have options for vegan tinos as well which are just as delicious. The price is good too which are comparable to empanadas in the area but here you get more flavor and value for your money.More,50,June 2022,COM,"Tino, esto no es una pizzería"
"They are the cutest and most delicious pizzas ever!! Very nice prices and customer service, we will visit again for sure!! Greetings from Turkey❤️❤️",50,June 2022,COM,"Tino, esto no es una pizzería"
"Smoothies are of fantastic taste and great size! Avocado toast / El Niño Toast was also great. Chimborazo is intgeresting. 

Smiley personnel is worth mentioning too! 

Visited the place 3 times, last time took a smoothie as a takeaway :)",50,February 2023,COM,Lato Café - Breakfast Brunch y Ceviches
"Great place to eat a healthy and different brunch. A little on the expensive side but totally worth it. My mouth is still watering thinking of the ceviche I had. The espresso was organic, from Peru and served with a presentation. The place doesn't open...the whole day so plan and book.More",50,February 2023,COM,Lato Café - Breakfast Brunch y Ceviches
"We had a great breakfast egg Benedict and El Nino toast with mimosa, tea and smoothie. Highly recommend 👌",50,November 2022,COM,Lato Café - Breakfast Brunch y Ceviches
"This is a lovely little place. I received the best welcome, great service from the super friendly guys, this cafe has a really relaxed vibe. Lovely, tasty, beautifully presented food of the highest quality, interesting drinks and amazing pancakes for desert. I’d not change a...thing about thisMore",50,November 2022,COM,Lato Café - Breakfast Brunch y Ceviches
"Great location for a cooked breakfast in the Eixample area of Barcelona. It was close to my hotel. The Eggs Benedict and Eggs Esmeralda were nicely portioned and tasty. Service was friendly and efficient. Ambience was nice, not too noisy.",50,October 2022,COM,Lato Café - Breakfast Brunch y Ceviches
Best brunch in Barcelona! Absolutely delicious! The service is great and the food is amazing! I would come here every Sunday for brunch!,50,October 2022,COM,Lato Café - Breakfast Brunch y Ceviches
"Creative menu, nice slection, also vegan and gluten free friendly, very tasty dishes and drinks, friendly and quick service.",50,October 2022,COM,Lato Café - Breakfast Brunch y Ceviches
"We went to Lat° Cafe twice during our Barcelona visit. Camel is a great server, he's soo friendly, kind and personable. The juice tastes amazing and the decor is adorable. The supreme omelette, Chimborazo and los monos are great dishes!",50,October 2022,COM,Lato Café - Breakfast Brunch y Ceviches
"The staff was very friendly and provided very good service. The Location ist nice and provided calm relaxinf environment. We hast very good omlettes, coffee and limonade for breakfast. We enjoyed very much.",50,October 2022,COM,Lato Café - Breakfast Brunch y Ceviches
Really cute place to have brunch. I had a bloody Mary and an omelet and my sister had pancakes and ceviche. Highly recommend.,50,September 2022,COM,Lato Café - Breakfast Brunch y Ceviches
"Just great. Nice staff, nice setting and good food. Eggs benedict were perfect, and the fries and platano were crispy outside and fluffy inside. Thanks for having us",50,September 2022,COM,Lato Café - Breakfast Brunch y Ceviches
Probably one of the best breakfast I’ve ever had. If you ever come to Barcelona you should definitely try the lato café.,50,September 2022,COM,Lato Café - Breakfast Brunch y Ceviches
"My boyfriend and our friend Lato Café for brunch on our trip to Barcelona. Not only was the food delicious, but the servers were so friendly! Our server Diego was amazing. He gave us lots of ideas for places to go an experience for tourist...attractions as well as some places to experience authentic Barcelona culture. Will definitely go back for brunch and bottomless mimosas 😋More",50,September 2022,COM,Lato Café - Breakfast Brunch y Ceviches
"Awesome experience, service was great and so was the food! They helped us with the menu, and gave great suggestions on other stuff to see in the city",50,September 2022,COM,Lato Café - Breakfast Brunch y Ceviches
"Stunning service and delicious food. Diego was great to chat to and made sure we had everything we needed. We ate the avocado toast and 4 egg omelette, huge portions, very tasty and great price! I had a lovely pineapple and mango juice that was...very refreshing. Would recommend to anyone in Barcelona. I will definitely be coming back next time I’m here.More",50,September 2022,COM,Lato Café - Breakfast Brunch y Ceviches
We went there on a Friday night as they had a live music. We had a great time with friends. Food is delicious and staff is super friendly. They are also popular for the brunch.,50,February 2023,COM,Cremat Lounge
"Very nice place we discovered in Barcelona looking for somewhere for dinner. Had a great singer performing. Super friendly staff and very welcoming, found us a table quickly even though we didn't have a reservation and it was a busy Friday night. Good food (tapas),...quick service. Recommend to go there.More",50,February 2023,COM,Cremat Lounge
I’ve been to Cremat 3 times over the last couple of months and the food and service is always great! All the staff are friendly and accommodating. Would definitely recommend the vegan breakfast!,50,February 2023,COM,Cremat Lounge
Cute nice breakfast place with big pancakes and super nice staff!! Recommend: Lady in Red Juice and Pancakes Royale!!!,50,February 2023,COM,Cremat Lounge
"A tall column of fluffiness in form of banana pancakes melted in my mouth, and the accompanying berries provided me with a glimpse of summer with their juiciness. Definitely a place to check out!",50,January 2023,COM,Cremat Lounge
"How big do you want your stack of pancakes? If the answer is very big, then this is the place for you. 
There was a brunch plate to suit every taste..... Fancy super sweet? There are Banana and butterscotch. Are you a savoury person? Try...the American breakfast. Quite frankly I am still thinking about that streaky bacon....... 
Are you and your partner more of a fancy affair? Eggs royale with some smoked salmon should be right up your street. 

10 mom, nom noms out of 10. Would nom again.More",50,January 2023,COM,Cremat Lounge
Spent our afternoon and evening at this bar. Tapas were the best we had in Barcelona 😻. Huge recommendation for a dinner after shopping. Drinks are very good and staff is lovely. We will definitely come back to this bar/cafe next time we’re in Barcelona,50,December 2022,COM,Cremat Lounge
After a few days of traditional spanish food we were very happy to stumble on this cafe/restaurant for a late breakfast. Great selection of pancakes and eggs in all styles. Good coffee and fresh pressed juices. Not crowded when we were there. Friendly staff and...prices reasonable. Not far from the university so perhaps that gave the place and area its young and hip vibe.More,40,December 2022,COM,Cremat Lounge
"absolutely worth a visit! 
We ordered different things and everything was perfect!!!
Will come back 100%",50,December 2022,COM,Cremat Lounge
The staff was super friendly and efficient. The food was amazing and I’ll definitely go back for our next visit to Barcelona. Have visited many brunch restaurants in the city but this was definitely the best one so far.,50,October 2022,COM,Cremat Lounge
"We stumbled upon this fantastic corner restaurant wandering Barcelona. The food was divine and they had plenty of gluten free  and vegan options for those interested. The drinks had fun names, the setting is divine, and the staff were all so lovely and kind. Highly...recommend!More",50,October 2022,COM,Cremat Lounge
"After going to the Cremat 11 location (who’s top tier by the way), the food and service was so good we just knew we had to go to the main one, the Lounge, plus, you can have bottomless mimosas for 10€ and when they say...bottomless hunni, they’re not lying, we walked off lit!! 
Anyway, I’d even recommend it to my worst enemy, the food is amazing and the staff even more, Jasper & Esmeralda were lovely, knew how to advise us amd guide us through their menu. 
We even ran into the owner and after exchanging with him quickly, you come to realize why the vibe is so good and the food follows.
Do not hesitate because you’ll miss out!!!
( The King Crab is a hit!! so good!)More",50,October 2022,COM,Cremat Lounge
"Great place, super friendly staff and delicious food! We went two times there during our stay in barcelona.",50,September 2022,COM,Cremat Lounge
"Such a great place for brunch with the girls! We were seven friends and they played 90’s music, were very lovely, food was amazing and mimosas and drinks were sooo yummy 🥂 
We came around 12.00 pm and stayed to 14.00, on a Friday. It...was not crowded!More",50,September 2022,COM,Cremat Lounge
"Headed over to this little gem after putting on our washing at Splash across the road. Ordered the vegan breakfast and it was delicious! Service was very friendly and attentive - what a great place to eat!
Coffee was great too - they had all...different milk variations which suited me fine.
Thank you
MargPMore",50,September 2022,COM,Cremat Lounge
"Excellent service, clean and the staff was wonderful. My new favorite place in Barcelona. It’s a must visit place every time in town. Ab Fab!",50,September 2022,COM,Dal Presidente Bar
"We came across this fantastic little bar just opposite the gay hotel by Axel. The pizza is delicious really Italian pizza with thin base and crusty bottom yummy! Alessandro the owner is a young guy full of joy and extremely friendly, you feel like you...have been drinking beautiful cold beer in this place for a long time. The environment is really friendly, if you are Italian go there, you can speak your language as many Roman’s seat there in the evening. We will definitely come back next year, that’s for sure! 😍 EnzoMore",50,September 2022,COM,Dal Presidente Bar
"an easy bar, cold beer, different screens, live   football an best of all delicious pinsas.
the bar is run by two Italians which explains why the pinsas taste like in Italy.
Its not a romantic place, they don‘t serve many different plates but for what...it is it definately derseves 5/5 stars.More",50,April 2022,COM,Dal Presidente Bar
"The waiter was very nice and made us feel very comfortable, overall excellent service. The pizza was also really good!!",50,April 2022,COM,Dal Presidente Bar
"The best pizza I’ve ever had, hands down 🙌🏽 - First place me and my partner tried when we arrived in Barcelona for a weekend away, 10/10",50,February 2022,COM,Dal Presidente Bar
"Me and my friends were hanging around, looking for a place for dinner and we arrived here by chance.
The staff is really friendly and they give you advices about the best plates and specialties to try, the food is amazing! Try their Pinza Romana...or La Mortazza: you’ll love it! Great wine and beers too! We will come back :)More",50,December 2021,COM,Dal Presidente Bar
"Small restaurant-bar, very friendly, welcoming staff. The bocadillo was excellent, very tasty bread and filling. Very reasonably priced.",50,August 2021,COM,Dal Presidente Bar
"If you want to eat pure Roman food, then this is the right place to go. They have everything you want, whether you want to drink or you want to eat. Prices are ridiculously low and the quality is truly high. I’ve been there with...five friends and we spent a really good time there. We’re going to come back, and I suggest this place to everyone who want to taste street Italian food. Drinks also excellent as well. Thank you Presidente!More",50,July 2021,COM,Dal Presidente Bar
"Awesome bar in a beautiful place, Alessio is very gentle! If you want to try the real Italian cuisine you must visit it, very recommended",50,January 2021,COM,Dal Presidente Bar
"Beautiful atmosphere, lovely italian corner in the hearth of Barcelona.
Good drinks (Spritz is a must) and amazing ""pinza"" romana with typical products from italy - porchetta / mortadella / nduja / fior di latte...

Worth a visit or two - per week!",50,December 2020,COM,Dal Presidente Bar
"Great ambiance, great staff and really nice food! Very funny owner! The Italian typical food was one of the best i ever had!",50,October 2020,COM,Dal Presidente Bar
"Tienem la mejor pizza que he comido en Barcelona y el local é muy agradable. Recomendo a todos que probem!!!

They have the best pizza I've ever proved in Barcelona and the place has an amazing comfortable atmosphere. I recommend it to everyone!!!

Eles tem...a melhor pizza de Barcelona e o local è super aconchegante e acolhedor. Eu super recomendo!!!More",50,October 2020,COM,Dal Presidente Bar
"Have to try special pizza from the house. 
It’s 14 euro. But it worst it. And very warm attentive and welcoming staff. Feels like you are in Italy",50,September 2020,COM,Dal Presidente Bar
"Nice little bar with a fun atmosphere, frieldly staff, good drinks and one of the best pizza I have ever had. Very affordable too. Great place to start a night out.",50,September 2020,COM,Dal Presidente Bar
Absolutely loved this place. Have to try the Pinza Romana and Aperol Spritz for a taste of real Rome ❤️,50,August 2020,COM,Dal Presidente Bar
Probably the best restaurant we have been to in Barcelona. Detailed explanation and gaudi-like presentation. Every dish was a masterpiece. Don't forget the wine pairing!,50,February 2023,COM,Con Gracia
"The experience was exceptional. The house-made salt that came with bread and olive oil was sublime. The dishes that followed—truffle risotto, octopus ball, mullet, palate cleanser, acorn-fed Iberian pork steak, and dessert tree—were all highly sophisticated and delightful. On top of that the wine pairing...was uncanny. But most of all, Jose and his team showed me what it means to feel deeply cared as a guest. It was soul-touching. I pay my deep respect to him and his team.More",50,January 2023,COM,Con Gracia
"Con Gracia is one of, if not the best restaurant in Barcelona. First of all, the food itself is a dream, but this is topped by the exceptional service. 
Always a pleasure",50,January 2023,COM,Con Gracia
