review,rating,date,language,restaurant
"Αυτό το cafe βρίσκεται σε καλή τοποθεσία και ωραία διακοσμημένο εσωτερικό, αλλά είναι ένα πολύ μικρό μέρος. Το προσωπικό ήταν φιλικό, και υπήρξαν πολλά γευστικά - αναζητούν επιλογές στο μενού (συμπεριλαμβανομένων χορτοφαγική επιλογή) . Τα γεύματα μας ήταν όλα τα νόστιμα, συμπεριλαμβανομένου ενός ισπανική ομελέτα.",50,Ιούνιος 2018,COM.GR,Paisano Bistro
"Είχαμε δείπνο στο Gusto την τελευταία νύχτα της κρουαζιέρας μας στη Μεσόγειο. Το φαγητό και οι υπηρεσίες ήταν εξαιρετικές. Ήμασταν ένα πάρτι 11 και μας φιλοξένησαν όμορφα. Είχαμε πίτσα, ριζότο, λαζάνια, σαλάτα του Καίσαρα και πολλά άλλα. Είχαμε επίσης αρκετές φιάλες εξαιρετικού κρασιού. Όλα σε...ένα υπέροχο βράδυ.Περισσότερα",50,Ιανουάριος 2020,COM.GR,Gusto
"Τελευταίος Πέμπτη έφυγα από τη Βοστώνη σε μια τεράστια χιονόπτωση. Μέχρι τη στιγμή που πήγα σπίτι στη Βαρκελώνη, είπα στον σύζυγό μου ότι ήμουν πολύ κουρασμένος για να μαγειρέψω. Πρότεινε να δοκιμάσουμε την πίτσα
τοποθετήστε το GUSTO στη γωνία του διαμερίσματός μας. Φτάσαμε. Όταν φτάσαμε,...ο χώρος ήταν άδειος. Ο σύζυγός μου διέταξε την 4 πίτσα τυριού και ένα μπουκάλι μεταλλικό νερό.
Δέμησα την πίτσα μανιταριών και ζήτησα ένα ποτήρι νερό βρύσης. Ο κοπατέας έφυγε! ! Σαρκαστικά μου είπε ότι δεν εξυπηρετούν το νερό της βρύσης. Του είπα ότι έχω ζει στην Barrcelona για 3 χρόνια. Βάζω καθημερινά τα δόντια μου και το πίνω κάθε μέρα και είμαι σε άριστη υγεία. Είπε κάτι αγενής στο Sanish και ο σύζυγός μου που ήταν ισπανός μίλησε σε αυτόν. Για την πίστη του, ο σερβιτόρος δεν απολογηθεί, αλλά κατέστρεψε ολόκληρο το δείπνο. Η πρότασή μου για την Mercadon να αγοράσει μια παγωμένη πίτσα για 3 ευρώ θα είμαι καλύτερη ποιότητα και καλύτερη γεύση. Ο λογαριασμός μας ανήλθε στα 35 ευρώ για 2 πίτσες ένα νερό και μία έρημο. Η πρότασή μου αν θέλετε πραγματικά ιταλικά να πάτε στο Greco. Θα μπορούσε να κοστίσει περισσότερο, αλλά αξίζει τον κόπο. Σκάφος Gusto.Περισσότερα",10,Δεκέμβριος 2019,COM.GR,Gusto
"Πολύ ζεστό και ωραίο μέρος. Καλύτερη πίτσα. Είχα την καλλονή με τυρί και ζαμπόν τόσο στο εσωτερικό όσο και στο εξωτερικό. Το προσωπικό ήταν υπέροχο, ειδικά ο διακομιστής Dario!Περισσότερα",50,Δεκέμβριος 2019,COM.GR,Gusto
"Το καλύτερο . . . . Όχι πραγματικά. . . ό, τι επιλέγετε. . . top, κορυφαία ποιότητα και VFM - απλά το κάνετε! Η πίτσα και οι ριζότοι οφείλονται και η πανακότα είναι η καλύτερη! ! !",50,Σεπτέμβριος 2019,COM.GR,Gusto
"Κομψό ιταλικό εστιατόριο με ένα υπέροχο μενού. Το προσωπικό ήταν φιλόξενο και η εξυπηρέτηση ήταν άμεση και φιλική. Είχαμε πίτσες (νόστιμη βάση, μην ξεχνάτε ότι οι λευκές πίτσες δεν έχουν ντομάτα και τα 4 τυριά ήταν εξαιρετικά τυριά), ζυμαρικά (άψογη) και το πιο νόστιμο φιλέτο...φιλέτο που είχα οπουδήποτε. Θα επανέλθω στη Βαρκελώνη ειδικά για να το ξανακάνω αυτό. 5 * φαγητό, 5 * υπηρεσία, πολύ λογικές τιμές.Περισσότερα",50,Σεπτέμβριος 2019,COM.GR,Gusto
"Απολαύσαμε ένα ευχάριστο γεύμα εδώ, η εξυπηρέτηση ήταν εξαιρετική. Το φαγητό ήταν πολύ νόστιμο και το επιλεγμένο κρασί πήγε καλά με το γεύμα μας.Περισσότερα",50,Απρίλιος 2019,COM.GR,Gusto
"Πολύ ωραία ιταλική θέση στο κέντρο της Βαρκελώνης.
Είχαμε πίτσα και καλό κρασί. Τα συστατικά είναι νόστιμα και σίγουρα καλά αναμιγμένα. Τελικά είχαμε τιραμισού και μπαμπά με το Λιμόντσελο.
Ένα καλό μέρος για να περάσετε ένα δείπνο με φίλους.Περισσότερα",50,Μάρτιος 2019,COM.GR,Gusto
"Έχω παραγγείλει ήδη 3 φορές πίτσα και πάντα είχα ένα καταπληκτικό προϊόν. Το ίδιο γούστο με το Neaples και όταν λέω ότι εννοώ την πραγματική περιοχή Tribunali. Η γεύση της μοτσαρέλας είναι μεγάλη και όλα τα προϊόντα είναι καθαρά και φρέσκα. Το χρώμα της ζύμης...πίτσας είναι το σωστό ροζ χρώμα που σημαίνει ότι υπάρχει μια τέλεια ισορροπία μεταξύ ωρών ωρίμανσης και ποσότητας ζύμης. Αυτή η ισορροπία δεν είναι εύκολο να επιτευχθεί! Επιπλέον, η βάση πίτσας είναι καθαρή από επιπλέον αλεύρι. Αυτό σημαίνει ότι το maestro pizzaiolo δεν χρειάζεται επιπλέον κόλπα για να χειριστεί την πίτσα. Πρόσθεσα μερικές φωτογραφίες για να δείξω πόσο καθαρό είναι το κάτω μέρος της πίτσας. Αυτή η δεξιότητα έρχεται μόνο μετά από πολλά χρόνια εμπειρίας.Περισσότερα",50,Φεβρουάριος 2019,COM.GR,Gusto
"Επισκέφτηκε τον Ιανουάριο ως σόλο για επαγγελματικό ταξίδι.

Παραγγείλαψα την καλλονή που ήταν ωραία και βγήκε από την κουζίνα πολύ γρήγορα!
Για επιδόρπιο είχα ένα σουφλέ σοκολάτας και ένα παγωτό που ήταν υπέροχο! ! !

Η εξυπηρέτηση ήταν καλή, ο χρόνος ήταν καλός. Θα επισκεφθεί...ξανά.Περισσότερα",40,Ιανουάριος 2019,COM.GR,Gusto
"Αυτό που μας άρεσε για αυτό το εστιατόριο είναι ότι οι ιδιοκτήτες της Σικελίας. Η πίτσα ήταν φανταστικό. Πράγματι, καλύτερο από ό,τι είχαμε στη Φλωρεντία, Ρώμη, και Capri! Πήρα μια τα οστρακοειδή προσθέτοντας ζυμαρικά και ήταν καλό. . . λίγο μονότονο. Η εξυπηρέτηση ήταν εντάξει..... . δεν είναι τέλεια. Σίγουρα θα ξαναπάω για την πίτσα.Περισσότερα",40,Ιούλιος 2018,COM.GR,Gusto
"Αυτό είναι ένα εκπληκτικό ιταλικό εστιατόριο με νόστιμη πίτσα σε λεπτή ζύμη! Νόστιμο μεσημεριανό μενού με λογική τιμή. Πολύ καλό κρασί (προσπάθησα όλα bianco, rosso e ροζέ! )
που έχω φάει εδώ περισσότερο από το ήμισυ του κατά τη διάρκεια γεύμα μου 2 - εβδομαδιαία...διαμονή.
Εξαιρετική φιλοξενία του ιδιοκτήτη και μπορείτε να παρακολουθήσετε αγώνες για το Παγκόσμιο Κύπελλο Ποδοσφαίρου εδώ!Περισσότερα",50,Ιούνιος 2018,COM.GR,Gusto
Καλύτερο Ιταλικό εστιατόριο στη Βαρκελώνη! Καταπληκτική ατμόσφαιρα με πολύ ευγενικό προσωπικό. Είχαμε μία από τις καλύτερες πίτσες στη ζωή μου.Περισσότερα,50,Νοέμβριος 2017,COM.GR,Gusto
"Έχει σταματήσει, καθώς είναι πολύ κοντά στο ξενοδοχείο μας. Είχα μια πίτσα, και η γυναίκα μου είχε ένα calzone. Τόσο εξαιρετική γεύση, ωστόσο ένιωσα κόρας μου ήταν λίγο κάτω από κάτω. Εξακολουθώ να έφαγε κατ' όμως. Το κρασί ήταν φθηνό και πολλές διαφορετικές επιλογές ζυμαρικών.",40,Σεπτέμβριος 2017,COM.GR,Gusto
"Έχω beem εδώ δύο φορές και είναι ένα εστιατόριο το οποίο, κατά την άποψή μου, το καλύτερο ιταλικό στη Βαρκελώνη. Ο ιδιοκτήτης είναι παθιασμένη και φιλικό και η εξυπηρέτηση είναι πολύ καλή. Λάτρεψα το λαζάνια και τα ζυμαρικά. Θα ήθελα να επισκεφθείτε αυτό το μέρος...κάθε φορά που έρχομαι στη Βαρκελώνη.Περισσότερα",50,Σεπτέμβριος 2017,COM.GR,Gusto
"Η οικογένειά μας κόμματος 8 επισκέφθηκε μετά από ένα υπέροχο γεύμα το βράδυ πριν από άλλο εστιατόριο έτσι τις προσδοκίες μας ήταν υψηλό.

Ήταν περισσότερο από προϋποθέσεις. Ο ιδιοκτήτης φαινόταν μετά από εμάς τόσο καλά που υποδηλώνει πιάτα μας δεν ήταν εξοικειωμένοι με και βοηθώντας...μας να επιλέξετε τη σωστή ποσότητα τροφής (συχνά για πάρα πολύ) . Ότι κάνει τα platters διαμοιρασμού και όλοι το λάτρεψα.

Μεγάλη λίστα κρασιών με ορισμένες φιάλες υψηλής ποιότητας σε λογικές τιμές.

Εξαιρετικό σπιτικά ζυμαρικά ήταν μια απόλαυση να φάτε.

Πρώτης τάξεως πουτίγκες υπερβολικά. Νομοσχέδιο το οποίο ήταν επαρκές για την ποιότητα και τα επίπεδα εξυπηρέτησης.

Συνολικά θα μπορούσα να βρώ τίποτα. Αξίζει να το επισκεφθείτε.Περισσότερα",50,Ιούλιος 2017,COM.GR,Gusto
"Ιταλικό εστιατόριο με κλασικό μενού και πίτσα. Φιλικό προσωπικό, απασχολημένος, κακή ακουστική κάνουν το μέρος κάνει θόρυβο όταν πλήρως κατειλημμένο. Η ποιότητα του φαγητού είναι τέλεια, κύρια ζυμαρικά ήταν λίγο μικρό αλλά νόστιμα φρέσκα μανιτάρια. Χρησιμοποιήστε λιγότερο λάδι truffel!",40,Αύγουστος 2017,COM.GR,Gusto
"Μακράν το καλύτερο φαγητό και πολύ εξυπηρετικό εστιατόριο που έχω πάει στη Βαρκελώνη. Μεγάλες πίτσες, κρασί και ζυμαρικά. Σίγουρα θα επιστρέψω! Ο φίλος μου χρέωσαν σε Δολάρια από ατύχημα και ο διευθυντής ήρθε και παρόλο που ήταν πραγματικά γεμάτη ανέφερε ακόμη χρόνο για να διορθώσετε...το πρόβλημα.Περισσότερα",50,Αύγουστος 2017,COM.GR,Gusto
"Αυτή είναι και η δική μας secomd επίσκεψη σε αυτό το εστιατόριο σε πολλές επισκέψεις στη Βαρκελώνη. Ανυπομονούσαμε να επιστρέψει για να αντισταθμίσει τις παραδοσιακές συνταγές της Καταλωνίας. Για άλλη μια φορά, αυτό το μέρος ήταν μέχρι την απόλαυση. Οι γεύσεις ήταν απλά εκπληκτικό σε...μια ζεστή και γραφική ατμόσφαιρα. Σίγουρα το συνιστώ ανεπιφύλακτα.Περισσότερα",50,Αύγουστος 2017,COM.GR,Gusto
Μας νύχτα στο Gusto ήταν συναντήθηκε με προσωπικό πάθος και συγκλονιστική τροφίμων. Είχα το Half Moon Ραβιόλι με porchini μανιταριών και ήταν καταπληκτικό. Ο σύζυγός μου είχε την αστακομακαρονάδα και ήταν εξίσου νόστιμο. Θα επανέλθω εν ριπή οφθαλμού. Συνιστάται ανεπιφύλακτα.,50,Αύγουστος 2017,COM.GR,Gusto
"Χρειαζόμαστε μια αλλαγή από τάπας αφού περάσαμε 4 ημέρες στη Βαρκελώνη. Εμείς απλώς προήλθε από την Ιταλία ταξίδι με την οικογένεια και το φαγητό ήταν καλύτερο εδώ στο Gusto! Ζούμε σε Νέα Υόρκη είναι πολύ ιδιότροπους μας φαγητό και εξυπηρέτηση. Αυτό ξεπέρασε τις προσδοκίες μας....Τα φρέσκα ζυμαρικά (τρούφες! ! ) είναι εκπληκτικό, το κρέας ήταν μαγειρεμένο άψογα και ιταλικά κρασιά όλη τη σύζευξη τέλεια. Όλα τα παιδιά το λάτρεψαν. Η εξυπηρέτηση ήταν πρώτης τάξεως. Ο ιδιοκτήτης Renato μας συμπεριφέρθηκαν σαν οικογένεια - - τα πάντα ήταν εξαιρετική.Περισσότερα",50,Αύγουστος 2017,COM.GR,Gusto
"Απίστευτες γεύσεις να το επισκεφθείτε!
Πολύ ευγενικό προσωπικό,πολύ νόστιμα πιάτα ειδικά το πιάτο που απευθύνεται για τους βιγκαν είναι πεντανόστιμο 
(Χωρίς να είμαι)",50,Μάρτιος 2020,COM.GR,Cremat 11
"Παρα πολύ νόστιμα πιάτα, πολύ καλή επιλογή. Συνήθως έχει αναμονή αλλά βρίσκεις γρήγορα τραπέζι. Είναι λίγο ακριβό σε σχέση με άλλα παρόμοια.Περισσότερα",40,Ιανουάριος 2020,COM.GR,Cremat 11
"Απλά δεν θα βρεθεί αυτό το μέρος αν αναρωτιέστε απλά γύρω από τη Βαρκελώνη που είναι τόσο ντροπή γιατί ήταν εκπληκτικό, το εστιατόριο είναι μικρό, αλλά τόσο χαριτωμένο και κομψό και το φαγητό ήταν πραγματικά εκπληκτικό, είχαμε τη μπανάνα τηγανίτα στοίβα (χωρίς μπανάνα ) και...ήταν το UNREAL τα εδώδιμα λουλούδια και η αλατισμένη σάλτσα κάμερας το πήραν σε άλλο επίπεδο, ο σύντροφός μου είχε το Λουκάνικο και τα τσιπ - το οποίο ήταν τόσο φρέσκο τόσο νόστιμο και όχι όπως θα μπορούσατε να έχετε στο σπίτι. Τέλειο brunch! ! Συνιστούμε να επισκεφτείτε:)Περισσότερα",50,Ιανουάριος 2020,COM.GR,Cremat 11
"Εξαιρετικό φαγητό, εξαιρετικό περιβάλλον (ακόμα και σε μια βροχερή μέρα, πολύ καλό φωτισμό), πολύ ζεστό προσωπικό και πολύ γρήγορα!
 Το 100% συνιστά (οι πατάτες από βατόμουρο είναι ονειρικές). Και η τιμή είναι πολύ δίκαιη για την ποιότητα του φαγητού!",50,Ιανουάριος 2020,COM.GR,Cremat 11
Εξαιρετικό φαγητό και ατμόσφαιρα. Μου άρεσε η υπηρεσία! ! Πολύ θερμή ατμόσφαιρα! Τέλειο brunch. Συστήνω ανεπιφύλακτα!,50,Ιανουάριος 2020,COM.GR,Cremat 11
"Εντυπωσιακός Βενέδικτος. Νόστιμες τηγανίτες. Ο καφές δεν ήταν καταπληκτικός, αλλά δεν κατέστρεψε την εμπειρία με κανένα τρόπο.Περισσότερα",50,Ιανουάριος 2020,COM.GR,Cremat 11
"Ποτέ δεν δημοσιεύω κριτική για την ΤΑ, αλλά σε αυτή την περίπτωση ένιωσα υποχρεωμένη να το κάνω. . .

Είχα ένα brunch εκεί τον Νοέμβριο και ήταν μια τόσο μεγάλη εμπειρία που αποφάσισα να επιστρέψω για δείπνο και στη συνέχεια μόνο για ποτά. Δεν θα...μιλήσω για το brunch, κανένα σημείο, άλλοι άνθρωποι έχουν πει αρκετά, είναι σίγουρα το καλύτερο στη Βαρκελώνη και πράγματι, οι τηγανίτες τους θα πεθάνουν για.

Αυτό που με εξέπληξε ήταν η νυχτερινή ατμόσφαιρα, αριστοκρατικό αλλά φιλόξενο, τα κοκτέιλ είναι εξαιρετικά καλά αναμειγμένα και το προσωπικό που εργάζεται εκεί είναι πραγματικά πολύ κουβεντούλα, εξαιρετικά προσιτό. ήμασταν με ένα σωρό φίλους και είχαμε πραγματικά έναν μεγάλο χρόνο.

Το δείπνο ήταν και πάλι εξαιρετικά καλό, πολύ καλή αξία για τα χρήματα. Φυσικά, δεν είναι τόσο φθηνή όσο κάποια άλλα μέρη, εφαρμόζεται ένα μικρό ασφάλιστρο και έτσι πρέπει. Ελπίζω να διατηρήσουν αυτές τις τιμές ώστε να διατηρήσουν μια τέτοια ποιότητα, η οποία είναι πολύ σπάνια για αυτούς τους τύπους θέσεων στη Βαρκελώνη. Επισκέπτω αυτή την υπέροχη πόλη πολλές φορές το χρόνο και το καθιστώ σημείο για να επισκεφτώ πολλά μπαρ και εστιατόρια και πρέπει να πω ότι αυτό το μέρος είναι το νέο μου αγαπημένο. Ειλικρινά, σε μια τόσο μεγάλη ποικιλία επιλογών στη Βαρκελώνη, ο χώρος αυτός είναι πραγματικά αναζωογονητικός, έτσι ώστε τα καπέλα να βγουν στην ομάδα και στη Διοίκηση εκεί! !

Απλά μην διστάσετε, απλά να φτάσετε εκεί και να απολαύσετε την εμπειρία του Kremat 11 είτε για brunch (πραγματικό MUST!) Είτε για δείπνο, δεν θα το μετανιώσετε.Περισσότερα",50,Νοέμβριος 2019,COM.GR,Cremat 11
"Αυτό το μέρος είναι ένα πανέμορφο κρυμμένο στολίδι. Πήγαμε για brunch είχε hadreos rancheros και τοστ αβοκάντο και το καλύτερο καφέ από τότε που πήγαμε στην Ισπανία. Στη συνέχεια μας έδωσαν ένα κουπόνι για να έρθουμε ξανά για δείπνο μια βραδιά και καθώς είχαμε μόνο...μια ολόκληρη μέρα αποφασίσαμε να επιστρέψουμε την ίδια μέρα για δείπνο.

Το δείπνο και τα κοκτέιλ ήταν εκπληκτικά. Είχαμε σχεδόν όλα τα κύρια στοιχεία και ο σύζυγός μου διέταξε ακόμη και ένα δεύτερο χταπόδι ότι ήταν καλό. Αγαπούσε τα κοκτέιλ στα γόνατα των μελισσών και τα λευκά σαγγρικά.

Σεφ όμορφη και τόσο ωραία να μπορέσετε να δείτε την δουλειά της! Οι σερβιτόρες μας και το πρωί και το βράδυ, όπου και υπέροχο!Περισσότερα",50,Οκτώβριος 2019,COM.GR,Cremat 11
"Αυτό το εστιατόριο αξίζει περισσότερα από 5 αστέρια! Το περιβάλλον είναι πολύ ζεστό και ωραίο, τα τρόφιμα είναι νόστιμα και το προσωπικό είναι φιλικό. Θα επιστρέψουμε! Συνιστάται.",50,Οκτώβριος 2019,COM.GR,Cremat 11
"Η υπηρεσία, τα τρόφιμα και τα κοκτέιλ είναι εξαιρετικά. Πηγαίνετε εκεί για brunch και θα φάτε τις καλύτερες τηγανίτες που μπορείτε να πάρετε. Προσθέστε λίγο μπέικον και ένα ποτήρι Cava και καθίστε στη βεράντα για να χαλαρώσετε. Θα πάει σίγουρα εκεί ξανά και ξανά.",50,Οκτώβριος 2019,COM.GR,Cremat 11
"Το αγαπημένο μου μέρος από την Bcn είναι εξαιρετικό, εκπληκτικό φαγητό, πολύ καλό κοκτέιλ (το γόνατο της μέλισσας είναι υποχρεωτικό), δίκαιες τιμές, καλή εξυπηρέτηση.
Επιστρέψαμε 3 φορές σε αυτό το μέρος, για brunch κατά τη διάρκεια της ημέρας και επίσης για ποτά το βράδυ. Το...μενού τροφίμων και ποτών καλύπτει ένα ευρύ φάσμα προτιμήσεων. Ωραία μουσική, καλές δονήσεις, δεν μπορεί να περιμένει να πάει πίσω.Περισσότερα",50,Οκτώβριος 2019,COM.GR,Cremat 11
"Ήμουν εδώ με φίλους και τα επιδόρπια που πήραμε ήταν πολύ νόστιμα. Επίσης, η Aida, η κοπέλα που μας υπηρέτησε, ήταν πολύ ωραία.Περισσότερα",50,Ιούλιος 2019,COM.GR,Cremat 11
Δεν υπήρχαν αμφιβολίες Ο ΚΑΛΥΤΕΡΟΣ ΑΓΩΝΑΣ που είχαμε στη Βαρκελώνη! (Και βρισκόμαστε σε άλλα δημοφιλή μέρη για να συγκρίνουμε!). Έχει γεύση τόσο νόστιμο όσο φαίνεται. Είχαμε το Rancheros και τα αυγά Benedict και ήταν τέλεια μαγειρεμένα. Θα επιστρέψουμε αφόρητα πριν φύγουμε από τη Βαρκελώνη! !,50,Απρίλιος 2019,COM.GR,Cremat 11
Ψάξαμε για τη σάνγκρια στη Βαρκελώνη και την βρήκαμε στο Cremat 11! Νωπά και νόστιμα όπως θα έπρεπε. Κοκτέιλ ήταν επίσης νόστιμο! Με τον τρόπο που αγαπούσαμε τις ροζ καρέκλες και τα φώτα. Σίγουρα ένα ζεστό μέρος για ένα αργά δείπνο στο.,50,Απρίλιος 2019,COM.GR,Cremat 11
"Μεγάλα vibes, όμορφη διακόσμηση & εξαιρετικό φαγητό! Σίγουρα θα είναι πίσω το brunch ήταν υπέροχο Best Αυγά Benedict! ! Το προσωπικό και η εξυπηρέτηση ήταν εξαιρετική η σερβιτόρα μου ήταν υπέροχη.",50,Απρίλιος 2019,COM.GR,Cremat 11
