review,rating,date,language,restaurant
"Muito bom! Ambiente agradável, ótimo atendimento, comida gostosa. Adorei! Tudo no estilo tapas e bem servido com boas opções de vinho.",50,dezembro de 2021,PT,Babula Bar 1937
"Chegamos quase na hora de encerrar a cozinha, mas conseguimos ser atendidos! A garçonete nos explicou e sugeriu os melhores pratos, a burrata é maravilhosa e o steak tartar com ovo pochet também! Meu esposo pediu cerveja e eu experimentei um drink com fogo que...também aprovei!Mais",50,novembro de 2021,PT,Babula Bar 1937
"Perfeito…
Tudo maravilhoso . Simpatia , atenção , cuidado .. comida.
Todos os colaboradores são super atenciosos. 
10 de avaliação🙌🙌Mais",50,novembro de 2021,PT,Babula Bar 1937
"Atendimento pontual,comida maravilhosa e o cordeiro é dos deuses
Obs:preço muito acessível para o nível da culinária",50,janeiro de 2020,PT,Babula Bar 1937
"Ambiente muito agradável, comida muito saborosa, bebida também, música excelente e atendimento do gerente Santí estupendo!!👍🏼👍🏼
Recomendo bastante! 5 ⭐️",50,outubro de 2019,PT,Babula Bar 1937
"Lugar surpreendente, entramos sem nenhuma pretensão e fomos muito bem recepcionados pelo Giorgio.
Logo no início sentimos o atendimento diferenciado, ambiente mega agradável, musica boa e comida excepcional.
Pedimos Burrata de entrada (maravilhosa), uma salada de tomates de temporada (foto), um sanduíche de carne de...Mais",50,março de 2019,PT,Babula Bar 1937
"Uma vibração tão legal, fácil de lidar, ótima comida, ótimo vinho e um tempo fantástico! E os garçons são de outro mundo descolados, simpáticos e divertidos! Muito obrigado!Mais",50,outubro de 2020,PT,Babula Bar 1937
"Foi a minha primeira vez aqui, vim com um amigo que já tinha estado várias vezes antes e recomendou. O serviço é muito amigável, eles realmente fazem você se sentir bem-vindo. Amei o design e foi aconchegante. Amplo bar para coquetéis e drinks, vinho branco...de muito bom gosto. Nós compartilhamos vários pratos diferentes e tudo era saboroso (bravas, frango teriyaki gyozas, tartar de atum e camarões). . A única coisa que gostaria de melhorar é adicionar mais opções vegetarianas. . Não é o lugar mais ideal para vegetarianos, pois o menu é bastante baseado em carne / peixe. Recomendado!Mais",50,outubro de 2020,PT,Babula Bar 1937
Comida deliciosa e serviço fantástico. Santi e Niko são ótimos rapazes sempre dispostos a ajudar. Estamos muito gratos a eles pelos ótimos momentos que passamos lá.Mais,50,outubro de 2020,PT,Babula Bar 1937
"Santi era nosso garçom e ele não poderia ter sido mais útil. Tínhamos reservado uma mesa do lado de fora, mas o tempo estava muito mais fresco do que o esperado, então ele nos encontrou um lugar dentro. Ele explicou tudo no menu detalhadamente. O...serviço foi rápido e cortês. A comida era interessante e deliciosa. Eu recomendo o Babular Bar para uma grande noite fora - eles realmente garantem que você aproveite a experiência.Mais",50,setembro de 2020,PT,Babula Bar 1937
"Esse lugar é ótimo! O ambiente é legal e a equipe é muito simpática, você pode dizer que fazer os clientes felizes é a sua principal prioridade. A comida é muito boa e oferecem uma grande variedade de tapas saborosas! Vale 100% a pena. Faça...um favor a si mesmo e visite este lugar!Mais",50,setembro de 2020,PT,Babula Bar 1937
"Eles compram todos os produtos locais, frescos e de cozimento lento. Todos os tipos de tapas e saladas com pratos especiais à vista, como ostras ou ceviches. O cordeiro e os nachos são os melhores que já provei. O serviço é muito dedicado e amigável....Eles têm um bar de coquetéis incrível, vale muito a pena ir com amigos ou casal, principalmente nos primeiros encontros!Mais",50,agosto de 2020,PT,Babula Bar 1937
"Tenho vindo a este lugar todas as vezes que estou em Barcelona e cada vez que recebo um serviço de primeira e comida de qualidade.

Recomendo totalmente! E eu vou continuar vindo para baixo.

Pegue o Canelon, a carrillera ou o Ceviche!

Obrigado por tudo....AlexMais",50,agosto de 2020,PT,Babula Bar 1937
"Simplesmente maravilhoso, mesmo não tendo no cardápio o que consigo comer, por ser bariátrico a Stephanie (maravilhosa garçonete) nos deu as melhores sugestões compatíveis, a comida estava formidável e o melhor atendimento que já tivemos em toda viagem!",50,fevereiro de 2023,PT,Prado de Flores
"Fomos atendidos pela Christal e a comida é excelente. 
Tem uma boa localização e a comida é óptima.
A paella de marisco é muito boa!",50,fevereiro de 2023,PT,Prado de Flores
"Fomos diversas vezes neste restaurante. Comida maravilhosa, paella, massa, lula a dore, polvo. Todos os pratos estavam excelente e o atendimento muito bom. Ambiente pequeno, mas agradável e charmoso.",50,janeiro de 2023,PT,Prado de Flores
"Gostei muito do atendimento, foi muito simpática, querida, o espaço é muito agradável, voltarei a repetir!",50,dezembro de 2022,PT,Prado de Flores
"Restaurante muito bom, com um custo benefício excelente. Preços bem realistas.

Especial para o atendimento - fomos atendidos pela ISHA. Muito simpática, atenciosa.

Recomendo vir aqui e depois sair andando pelas ruas próximas.",50,novembro de 2022,PT,Prado de Flores
Jordi recebeu-nos muito bem e foi muito atento. A comida é muito boa. Obrigada por tudo!!! Voltaremos em breve.,50,outubro de 2022,PT,Prado de Flores
"A pessoa que nos atendeu muito amável. 
A bebida que meu Mojito de morango veio errado, até aí tudo bem, a bebida voltou e eu vi que o bartender usou a mesma bebida e só adicionou syrup de morango, tirou um pouco da bebida e...colocou mais syrup, resultado drink marrom veio na mesa haha. Sabor? Quem sabe! Nada que lembrasse morango. OK.
Reclamei para ela e disse que realmente não tinha visto de morango. Ele pediu uma coca e tudo certo. 
Comida servida hambúrguer e polvo. Excelente. Muito gostoso meu polvo e segundo meu marido bom hambúrguer também.
Pedimos a conta. Veio outra atendente, loira, cobraram a bebida, pedi para retirar, e Ok e aí percebi que me contaram a mais pela sangria. E eu avisei olha no menu a sangria de lá casa custa €3 e estavam cobrando €6. Eu sei que não é muito gente, mas este não é o ponto. Ela disse mas a sangria normal custa isso. E eu respondi mas eu não pedi a NORMAL, e sim A DE LÁ CASA, enfim ficou por isso mesmo, ela queria discutir, então deixei por isso mesmo. Pagamos e aí atravessamos a rua e fomos no restaurante de ontem que tem o MELHOR MOJITO - SANTA ANNA! 

Não peça DRINKS no PRATO DE FLORES e sim atravessem a rua que é muito melhor!!!Mais",20,fevereiro de 2020,PT,Prado de Flores
"Provamos várias tapas e a pizza. Comida boa, ambiente agradável e ótimo atendimento. Preço alto para o tipo de itens que consumimos.",40,janeiro de 2020,PT,Prado de Flores
"Jantar em família neste restaurante devido à localização (em frente ao nosso hotel).
Considero caro pelo que entregou. Entrecot saboroso e macio, jamon muito caro, massas muito gordurosas. Mas o vinho da casa e as sobremesas foram ruins.",30,dezembro de 2019,PT,Prado de Flores
"Comida com preço justo, local agradavel e funcionarios atenciosos. Pedimos o menu do dia e fui surpreendida com a qualidade e sabor. Recomendo e voltaria!",50,novembro de 2019,PT,Prado de Flores
Ótima opção. Custo benefício excelente ao pedir menu do dia. Atendimento atencioso e gentil. Comida muito boa.,50,novembro de 2019,PT,Prado de Flores
"Muito bom . Tudo é bom de paella, a tapas, até pizza . Simplesmente fantástico é surpreendente. As pastas são muito boas para as crianças",50,novembro de 2019,PT,Prado de Flores
"Muito bom. Empregados muito simpáticos.
De entrada comemos uns mexilhões que estavam uma delicia.
Como prato principal comemos Paella com arroz Negro e estava divinal. Recomendo!",50,maio de 2019,PT,Prado de Flores
"Ambiente agradável, atendimento rápido e eficiente. Comida saborosa e preço compatível com o praticado em Barcelona, o que não é barato. Paguei 16,90 euros pelo menu do dia: Salada, Paella de frutos do mar e Sangria.",40,novembro de 2018,PT,Prado de Flores
"Lugar  agradável e aconchegante. Decoração simples. Próximo ao hotel  onde fiquei. Atendimento cordial com garções muito simpáticos. Preço acessível e comida saborosa. Comi pizza e tomei sangria, além de sopa por várias vezes no jantar.",40,maio de 2018,PT,Prado de Flores
"Você não da nada quando entra mas depois é só amor! Lugar agradável, os garçons são bem atenciosos! Comida bem gostosa!!!!!! Paella de mariscos + espaguete a bolonhesa + sangria ❤️",50,janeiro de 2017,PT,Prado de Flores
"Quando fui, experimentei uma pizza e depois nachos. Ambos estavam deliciosos. Tomei também uma cerveja/birra e uma Sangria, muito bons também. Recomendo.",50,novembro de 2016,PT,Prado de Flores
"O local é agradável e limpo. Os empregados são simpáticos. Apenas pedi uma sopa e um café. Apesar de saborosa, achei o preço versus quantidade exagerado. Não é local indicado para quem gosta de comer em quantidade. E os preços do menu são altos.",30,agosto de 2016,PT,Prado de Flores
"Ambiente simples , pequeno mas com ótimo atendimento Desjejum apresentado com um bocadillo de queso e jamon fabuloso",50,junho de 2016,PT,Prado de Flores
"Restaurante simples, os donos pareciam ser russos até porque o cardápio também estava em russo. A comida é muito boa e o preço também.",40,fevereiro de 2014,PT,Prado de Flores
"Muita simpatia de todos. Pratos bem elaborados, bem servidos e com preços justos. Boa variedade de vinhos italianos. No final nos foi oferecido um meloncello, excelente. Vale a visita.",50,setembro de 2022,PT,Anema E Core
Comida incrível e um ótimo atendimento. Uma  grande variedade de Tapas e o ambiente é super aconchegante. Recomendo demais.,50,agosto de 2022,PT,Bodega Oliva
"Excelente restaurante, grupo de 3 casais recomendo a tabla special (entrantes) e a pizza special.
Fomos super bem recebidos e o serviço foi sensacionql!!! Recomendo",50,novembro de 2021,PT,Don Kilo Gourmet
"Pizza italiana excelente, ambiente confortable e de quebra um chupete de licores incríveis. Vale muito!",50,outubro de 2021,PT,Don Kilo Gourmet
"Já experimentei diferentes pizzarias em Barcelona e posso dizer que a Pizza de Donkilo é a minha preferida: ingredientes de primeira qualidade, massa leve e fácil de digerir e melhor serviço.",50,outubro de 2020,PT,Don Kilo Gourmet
"100% recomendado, o melhor restaurante italiano da região, os funcionários são super simpáticos, a pequena Itália da Espanha.",50,outubro de 2020,PT,Don Kilo Gourmet
"Hospedagem incrível e pizzas super incríveis que são definitivamente gourmet! Recomendo a tentar este lugar. Também grande Prosecco, lugar realmente de alta qualidade!",50,outubro de 2020,PT,Don Kilo Gourmet
"Estava procurando um lugar onde comer uma verdadeira pizza napolitana e tristemente encontrei!
Adorei a pizza tradicional, mas também provei da frita. Estará de volta em breve! !",50,setembro de 2020,PT,Don Kilo Gourmet
Verdadeira e autêntica pizza napolitana com deliciosos toques. Equipe amigável que oferece um ótimo serviço. Estará de volta em breve!,50,setembro de 2020,PT,Don Kilo Gourmet
"Estive no restaurante em 2016 e amei e voltei pra conferir! Conseguiu ser ainda melhor! A comida incrível e fui mais uma vez recepcionada pelo fofo e caloroso dono Alal, que torna o almoço em uma experiência! Muito simpático, dá dica de pratos, quantidades, tira...foto, e faz você se sentir em casa!
Impecável, só tenho elogios!Mais",50,setembro de 2019,PT,Swagatam Bar-Restaurant Hindu
"Lugar simples e despojado, atendimento excepcional com um garçon super-animado e solícito, e uma comida simplesmente fantástica !!",50,novembro de 2017,PT,Swagatam Bar-Restaurant Hindu
"O lugar é super agradável com som indiano não sendo muito sofisticado. O dono foi super receptivo e as comidas foram excelentes! Para quem não gasta de pimenta deve pedir sem a mesma porque a comida é naturalmente mais picante mesmo! Os preços só são...um pouco caros se você não comer o menu do dia que vem com entrada, prato principal e salvo engano com sobremesa! De resto a experiência não tem preço!!! Recomendo!!!Mais",50,abril de 2016,PT,Swagatam Bar-Restaurant Hindu
"Escolhemos o Swagatam para um almoço em Barcelona após boas recomendações aqui do Tripadvisor.. e são muito merecidas.
A começar pela simpatia do Dono, indiano, que te atende com uma alegria cativante, além de ajudar na pedida.
A comida é autêntica e deliciosa, te fazendo...sentir na índia. E o preço, mais do que justo.
Experiência maravilhosa!!Mais",50,janeiro de 2016,PT,Swagatam Bar-Restaurant Hindu
Restaurante pequeno com ar de tasca. A comida tinha bom aspeto. A funcionaria foi desagradavel e malcriada ao explicar que tinhamos de esperar uns 30m. Foi insolente a tomar nota da reserva. Desistimos de jantar.,10,março de 2016,PT,Swagatam Bar-Restaurant Hindu
"A primeira vez que provei comida indiana, e foi uma experiencia incrível. Os empregados foram muito simpáticos, sendo que nos aconselharam uma entrada e dois pratos para dividirmos, dando um total final de 34€. Assim que nos sentamos, servem uma espécie de pão frito onde...aconselha a misturar nos 3 molhos que dispõe sobre a mesa. Como entrada, as cebolas desossadas são um must! Quero regressar numa próxima!Mais",50,março de 2016,PT,Swagatam Bar-Restaurant Hindu
"O melhor restaurante indiano que já fui! Preço justo, comida deliciosa (melhor chicken curry) e atendimento excelente! O dono e uma simpatia! Não chegue tarde, pois o restaurante e sempre cheio, se não conseguir chegar cedo, faça reserva. Vale muito a pena!",50,,PT,Swagatam Bar-Restaurant Hindu
"Agradeço ao tripadvisor ter chegado a este restaurante . Fabuloso , desde atendimento a comida indiana . Em 5 dias em barcelona foi lá 3 vezes . Mal vejo a hora de voltar a barcelona para repetir .",50,maio de 2014,PT,Swagatam Bar-Restaurant Hindu
"Serviço saboroso, saudável, bom preço e excelente. . . não há nada de errado a dizer sobre este lugar, absolutamente recomendado! !",50,setembro de 2020,PT,Swagatam Bar-Restaurant Hindu
"Bettina

 18: 27 (vor 0 Minuten)

fantástica cozinha indiana com uma grande variedade de pratos vegetarianos! ! ???
não podíamos deixar de voltar para o ambiente aconchegante, cuidado amoroso individual. . e o canto do Sr. LAL ??
um grande brinde à equipe maravilhosa -...vocês são almas adoráveis e incríveis. OBRIGADO ???
dirk e bettina (alemanha / índia)Mais",50,julho de 2020,PT,Swagatam Bar-Restaurant Hindu
"A comida é boa, mas o serviço lento trouxe para baixo o nosso prazer geral da refeição, assim como o fato de que estávamos sentados perto da entrada, por isso era um pouco barulhento e não muito acolhedor!",30,janeiro de 2020,PT,Swagatam Bar-Restaurant Hindu
"Comida e serviço realmente adorável. Nós compartilhamos alguns pratos vegetarianos, chamuças e naan, e tudo estava delicioso!",50,fevereiro de 2020,PT,Swagatam Bar-Restaurant Hindu
"Restaurante indiano fantástico e muito autêntico. Nossa seleção de caril estava delicioso, fresco, muito quente e muito picante (para nós). O anfitrião, Pratap, é uma alegria e muito amigável. Gostaria de recomendar a todos os amantes da cozinha indiana e um must - go para...os índios!Mais",50,dezembro de 2019,PT,Swagatam Bar-Restaurant Hindu
"Uma das melhores refeições indianas que experimentamos na Europa. Serviço foi incrível e preço muito, muito razoável.",50,novembro de 2019,PT,Swagatam Bar-Restaurant Hindu
"A equipe é muito simpática, o menu do dia tem um ótimo preço e todos serão super satisfeitos com muito bom gosto e muita comida.",50,julho de 2019,PT,Swagatam Bar-Restaurant Hindu
"Oh, o cavalheiro que dirige este lugar está cheio de calor e excelente cliente orientado Atitude positiva. Nós pedimos Roti, masala de manteiga de frango, Palak garimpou - comida era saborosa, picante para o ponto, higiênico e preparado com muito de especiarias indianas - os...chutneys eles servido era muito bom. O lugar é muito pequeno e isso seria um pouco inconveniente. Mais um bom lugar pequeno que lembra que você tem um pequeno restaurante na Índia

Continue assim e boa sorteMais",40,maio de 2019,PT,Swagatam Bar-Restaurant Hindu
Realmente gostoso e autêntica comida indiana servida por um proprietário muito simpático Mohan Lal. Deus abençoe. Ver você de novo.,50,maio de 2019,PT,Swagatam Bar-Restaurant Hindu
"Este é um lindo restaurante indiano que eu recomendaria a ninguém.

Possivelmente, a melhor refeição ""estrita por pão"" que eu tive - grande valor combinado com excelente comida é um modelo de negócio difícil que essa multidão dominou. Funcionários simpáticos, agradável atmosfera indiana mantida ea...comida foi excelente.

Não há queixas - mantenha o bom trabalho. Cumprimentos aos chefs!Mais",50,maio de 2019,PT,Swagatam Bar-Restaurant Hindu
"Outro dia em Barcelona e eu e meu amigo fomos descobrir um novo local para comida. As escolhas foram indianas e a primeira seleção Swagatam.
 Meu amigo tinha um tipo de frango Massala, eu fui a Chicken Saag. Ambos excelentes, o sabor era intenso e...saboroso.
 Mas antes tentámos entradas, legumes Pakoras e também escolheu Naan Butter, a equipe foi gentil e foi fundamental na escolha do tipo de Naan.

 Devo dizer que as doses são suficientes. O espaço é pequeno e não sei se aceitam reservas mas acho que merece a espera. Com certeza voltarei.Mais",50,abril de 2019,PT,Swagatam Bar-Restaurant Hindu
"O restaurante é muito pequeno e parece um pouco decaído no primeiro, mas a comida é realmente muito boa ea equipe extremamente amigável. Os preços são moderados e foi a melhor comida indiana que tivemos em um longo tempo. Nós nos visitaremos novamente assim que...tivermos a chance!Mais",50,abril de 2019,PT,Swagatam Bar-Restaurant Hindu
Mais,50,maio de 2022,PT,La Terraza De Anna By Vida Mona
Mais,40,janeiro de 2022,PT,La Terraza De Anna By Vida Mona
,50,novembro de 2021,PT,La Terraza De Anna By Vida Mona
Mais,50,novembro de 2021,PT,La Terraza De Anna By Vida Mona
Mais,50,outubro de 2021,PT,La Terraza De Anna By Vida Mona
Mais,50,setembro de 2021,PT,La Terraza De Anna By Vida Mona
,50,agosto de 2022,PT,La Terraza De Anna By Vida Mona
,50,julho de 2022,PT,La Terraza De Anna By Vida Mona
"Atendimento muito ruim. A comida vale 4 estrelas, porém o atendimento é muito ruim. Garçons pouco atenciosos.",20,dezembro de 2022,PT,La Cala Barceloneta
"AMAMOS O CAFÉ DA MANHÃ, bolo de banana excepcional, os lanches super gostosos e de bom tamanho.

O Café willi de bom agrado",50,julho de 2022,PT,La Cala Barceloneta
"Deliciosos taças de açaí, torradas e bolos caseiros, ótimo ambiente e serviço! ! Realmente amamos este lugar",50,abril de 2019,PT,La Cala Barceloneta
Ótimo café da manhã e com preços razoáveis. Eles têm um menu em inglês. Nós teve café-da-manhã aqui duas vezes e foram muito satisfeito ambas as vezes.,50,agosto de 2018,PT,La Cala Barceloneta
"Visitei aqui com oito outros casais. Nós não tínhamos reservado, mas a garçonete logo puxou algumas mesas juntos e estávamos prontos. Se você é um bebedor de bebidas alcoólicas, você realmente tem que gritar 'quando', enquanto ela está derramando a bebida ou ela vai continuar...indo lol. Todos nós tivemos uma mistura de carnes e frutos do mar todos que saiu bem preparados. Uma noite muito agradávelMais",50,agosto de 2018,PT,La Cala Barceloneta
Estive neste local há algum tempo e não fiquei desapontado. É certo pequeno dentro mas lugares fora oferecem-lhe bela vista e atmosfera pacífica. Algumas noções básicas de café da manhã são deliciosos. Faça sua parada!,50,agosto de 2018,PT,La Cala Barceloneta
"Lugar agradável perto da praia. Nós teve lanches leves e café expresso. Foi divertido assistir a jogos de praia, alguns se atreveram a nadar no mar frio.",40,março de 2018,PT,La Cala Barceloneta
"Nós viemos 8. 45 para la cala e ninguém estava lá, mesmo assim, disse ""todos os dias, 08. 30 -"" na porta. Nós estávamos prestes a sair, mas, em seguida, no mesmo segundo veio a equipe e openef até o local. Nós demos a eles...algum tempo e voltamos em torno de 09. 00 Eu tive o acaibowl e foi muito bom. Também tomou o sanduíche de abacate mas não era necessário, o acaibowl foi suficiente com alimentos. Bom lugar para tomar café da manhã, mas certifique-se de ter algum tempo se você fizer isso.Mais",40,outubro de 2017,PT,La Cala Barceloneta
"Apenas a 100 metros da estrada ultra-frequentada que vai do metro para a praia, este bar é como uma ilha pacífica em Barceloneta. Tem um agradável terraço e uma comida é saudável e bom, mas nem pretensioso nem tipicamente espanhol, tentámos as misturas de frutas...frescas, bolos caseiros e ambos foram excelentes.Mais",50,setembro de 2017,PT,La Cala Barceloneta
"Este lugar é dos mesmos proprietários como 'La Roseta de Barceloneta e a comida e bebidas são basicamente os mesmos. Tudo é muito saboroso, mas eles têm preços diferentes. . . as mesmas coisas em 'La Roseta' são mais baratos. Por conseguinte eu recomendaria para...visitar a localização antiga, mesma qualidade no ponto original. A única vantagem do novo local seria o agradável terraço ensolarado.Mais",50,maio de 2017,PT,La Cala Barceloneta
"Restaurante com comida muito saborosa, do tipo tapas. É necessário reservar. Preço um pouco elevado mas aceitável pela qualidade. Recomendado.",50,junho de 2022,PT,RAÓ Restaurant
"O atendimento, os cocktail, a comida.. tudo incrível! Ótima experiência gastronómica! Recomendo a 100%.
Tapas sofisticadas e com excelente sabor.
Sem dúvida que merece estar no top3 de melhores tapas de Barcelona.",50,outubro de 2022,PT,RAÓ Restaurant
"Tapas para compartilhar. Descoberta Maravilhosa! Ótimo custo benefício. Vale super a pena conhecer. Por se pequeno, aconselho fazer reserva antecipada.",50,agosto de 2022,PT,RAÓ Restaurant
"Espaço interessante com staff muito simpático e ótimo menu. De lamentar o ruído quando mesas de grupos, mas é o estado boémio de Barcelona.
Recomendo o lugar.",40,maio de 2022,PT,RAÓ Restaurant
"Excelente opção! É um restaurante/bar! Só consegui ir efetuando reserva. Um legitimo representante das tapas! Degustamos quatro pratos; cevicche, burrata, paella e de postre mousse de chocolate. Todos excelentes, mas a paella foi a melhor que degustei em minha vida! É um restaurante que merece...ser visitado para quem vier a Barcelona! Excelente e motivada equipe! Parabens pela excelencia!Mais",50,abril de 2022,PT,RAÓ Restaurant
"A comida é muito boa, mas as porções são muito pequenas diante do preço praticado, as tapas são praticamente individuais. O atendimento é cortês e os vinhos oferecido de boa qualidade. Recomendo.",40,fevereiro de 2022,PT,RAÓ Restaurant
"Comida deliciosa!!
O tartar de atum surpreendeu!!
Atendimento excelente e o Espaço muito agradável!!",50,fevereiro de 2020,PT,RAÓ Restaurant
Jantamos neste restaurante e a comida foi simplesmente soberba. O Pedro trouxe-nos o que achou mais indicado. Acertou em tudo. Simplesmente fantástico. Conto voltar.,50,fevereiro de 2020,PT,RAÓ Restaurant
Ótima comida!! Recomendo as vieiras e o pargo! Restaurante aconchegante e um ótimo atendimento do Pedro. Super recomendávelMais,50,janeiro de 2020,PT,RAÓ Restaurant
"Amei minha experiência no Rao!!! O restaurante é super charmoso e aconchegante, o atendimento excelente, (Pedro foi super solícito e muito simpático) e a comida espetacular!!! Estava tudo perfeito!!! recomendo o pargo e as vieiras!!!",50,janeiro de 2020,PT,RAÓ Restaurant
"As pessoas que trabalham lá são de uma simpática extrema. O ambiente é incrível e a comida é deliciosa. Sem dúvida que quando voltar a Barcelona, voltarei a este local. Obrigada pelo excelente serviço",50,fevereiro de 2023,PT,Taps
"E a gastronomia é óptima. Tapas são maravilhosas e paellas negras fantásticas. muito bom. Sumos e lanches, uau.",50,outubro de 2021,PT,Taps
"Desde o atendimento ao decor do espaço, tudo muito bom!
Bons vinhos, comida excelente!
Recomendo....",50,dezembro de 2021,PT,Taps
"O atendimento é fantástico, muita simpatia e bons conselhos.
A música reinou a refeição, muito boas escolhas musicais.
O mais importante, a comida estava deliciosa com um toque delicado. Chistorra é incrível.
E o preço final ainda melhor.
Muito obrigado pela atenção que me deu...hoje. Voltarei de certeza!!!Mais",50,dezembro de 2021,PT,Taps
"Óptimas tapas, sobremesa e sangria e atendimento rápido e os funcionários muito simpáticos. Recomendo!!!",50,novembro de 2021,PT,Taps
"Comida muito saborosa e funcionários extremamente atenciosos para explicar cada prato. 
Melhor Batatas Bravas da viagem.",50,setembro de 2021,PT,Taps
"Ótimo lugar para experimentar tapas. 
Comida deliciosa.
Atendimento rápido e atencioso.
Visitamos no nosso último dia em Barcelona. Se tivéssemos conhecido antes certamente teríamos voltado.
Dica: Caso for jantar faça reserva ;)",50,março de 2020,PT,Taps
"Restaurante de tapas,  muito bonito e bem decorado, empregados simpáticos e comida muito boa.
Uma boa surpresa. Recomendo.",40,novembro de 2019,PT,Taps
"Muito agradável,divertido as tapas são excelentes e os empregados top uma noite uma agradável e no final ofereceram um shot ervas",50,novembro de 2019,PT,Taps
