review,rating,date,language,restaurant
"O ambiente é diferenciado, drinks e música de qualidade, tapas bem feitos, o único problema foi o calor! Muito muito muito quente lá dentro e eles não têm ar condicionado nem ventilador, hoje estava 30 graus do lado de fora e provavelmente a sensação térmica...dentro do bar era de uns 35. Tinha tudo pra ser perfeito, atendimento de primeira, todos falam inglês, o que é um diferencial, são simpáticos. Mas o calor fez com que a gente quisesse terminar de comer logo pra poder respirar lá fora. Obrigada pela experiência e se possível coloquem um ventiladorzinho rsrsMais",30,agosto de 2019,PT,Taps
"Chegamos a este restaurante durante uma busca aqui no Trip Advisor por onde comer após visitar o Montjuïc e foi uma experiência sensacional! As tapas foram incríveis, com atendimento muito rápido e cuidadoso (pedimos o molho das batatas bravas separado após sugestão da atendente, que...Mais",50,agosto de 2019,PT,Taps
"Local pequeno e aconchegante, com ótimo atendimento. Comida ótima! Vale o Bloody Mary! Preço acessível, wifi e música ambiental relaxante",50,junho de 2019,PT,Taps
"Restaurante pequeno, não esperava me surpreender! Cerdo e bacalhau deliciosos! Sobremesa divina! Sangria deliciosa!",50,junho de 2019,PT,Taps
"Fomos a esse restaurante e, mesmo sem reserva prévia, eles conseguiram nos “encaixar” na fila de espera deles. Estava lotado! Tudo delicioso, serviço muito educado, valeu muito a pena! Recomendo!",40,maio de 2017,PT,Taps
"Adoramos o ambiente e os pratos deliciosamente preparados do Taps, perto da Praça Espanha, em Barcelona. O terrine de queijo de ovelha é especialmente delicioso! O chop também estava no ponto! Recomendo, para quem estiver nas proximidades.",40,novembro de 2016,PT,Taps
"Nós comemos aqui na nossa 2 visita a Barcelona. Nós estávamos realmente surpreendido. Óptimo, fresco, saboroso, a qualidade dos alimentos e vinhos. Funcionários simpáticos. Podemos acabar aqui novamente antes de deixar de Barcelona, e na próxima visita a cidade",50,novembro de 2015,PT,Taps
"Não seria as tapas que esperava provar em Barcelona. Diferentes, mas sem merecer uma ""voltarei"". Preço está na média.",30,dezembro de 2015,PT,Taps
"Pratos relativamente pequenos, e não tão baratos! Mau atendimento, demorado e pouco simpático... Mas o que decepcionou mais foi a qualidade e a variedade da comida. Cerca de 20€ por pessoa. Muito provavelmente pagam pelas avaliações altas e que ludibriam a verdadeira qualidade do restaurante.",10,agosto de 2016,PT,Taps
O restaurante possui um ambiente aconchegante e a comida é deliciosa. Recomendo!! Peça variedades para poder provar de tudo um pouco!,50,dezembro de 2015,PT,Taps
"Acertamos num dia que pelos vistos faltou um colega na cozinha por isso as tapas foram muito demoradas. Qualidades da comida boa. Apenas dois colegas a servir q nao tomavam muito bem conta do recado... Apesar de tudo, houve falta do stock (que a falta...Mais",30,março de 2016,PT,Taps
"Atendimento maravilhoso e comida IMPECÁVEL! Procurei um bom polvo por toda Barcelona e esse foi o MELHOR! Voltarei com certeza, recomendo fazer reserva pois vale.",50,fevereiro de 2023,PT,Viana
Pequeno bistrô. Aconselho reservar. Chegamos sem reserva e conseguimos s ser atendidos. Pessoal muito cortes e comida excepcional. Vale a pena. Burrata muito boa e menu degustação ótimo. Vale a pena trocar o vinho pelo recomendado pela casa.,50,janeiro de 2023,PT,Viana
"Surpresa incrível. 
Fomos a convite de um casal de amigos. Vi que a nota no trip é muito boa mas ao chegar no bairro/local confesso que achei que era uma cilada. Que nada!
Fomos muito bem recebidos pelos donos.
Vinhos bons e preços ok. Só...fica na mesa se vc aprovar mesmo. 
Não tem aquele atendimento ""corrido""
A comida é INCRÍVEL. 
Resumo. Noite agradabilíssima. Super recomendo de verdade.Mais",50,outubro de 2022,PT,Viana
Adoramos a comida ! Recomendamos a entrada de polvo e linguini ! Boa localização e ambiente agradável. Bom atendimento !,50,setembro de 2022,PT,Viana
"Excepcional! 
Chegamos sem reservar, mas fomos bem recebidas.
Aguardamos uns 20 minutos para sentar, e comemos muito bem.
A simpatia de Elias, o maître ou proprietário (não sei ao certo) foi o ponto alto da noite.
Recomendo super!
Melhor fazer reserva porque o local é...pequeno.Mais",50,maio de 2022,PT,Viana
"Maravilhoso!! Atendimento incrível, pratos absolutamente maravilhosos e sobremesa ótima também. Das melhores refeições que fizemos na cidade.",50,fevereiro de 2022,PT,Viana
"A melhor experiência que tivemos em Barcelona! Atendimento excelente, staff extremamente simpático. 
A comida é muito além do esperado, o tataki de salmão melhor que já comi na vida. 
Fomos surpreendidos com uma cortesia de rolinho primavera enquanto esperávamos o tataki. 
O meloso, não se...explica, molho perfeito, carne perfeita, purê aromático.
São certamente os pratos que indico. 
Não percam!!!Mais",50,dezembro de 2021,PT,Viana
"Certamente o melhor jantar em Barcelona. O atendimento é diferenciado e a comida é maravilhosa!!

Pedimos o linguine e o meloso, ambos sensacionais!! Super recomendo!",50,dezembro de 2021,PT,Viana
"Melhor restaurante de Barcelona. Comida impecável, atendimento impecável. Vale muito a visita se estiver nas redondezas !!!",50,outubro de 2021,PT,Viana
"Restaurante maravilhoso! Além da alta gastronomia um atendimento impecável!
Miguel nos surpreendeu com 3 drinks divinos! 
Pedimos o porco e o bacalhau e a sobremesa de chocolate! Tudo vale a pena!",50,outubro de 2021,PT,Viana
Fantástico !! Comida excelente!! Ambiente excelente !! Serviço excelente ! Experiência muito muito boa!!         Dos pratos principais as sobremesas estava tudo muitíssimo bom!!!,50,outubro de 2021,PT,Viana
"Fizemos uma reserva para o restaurante  sem saber que havia 2 . Ficamos no mais pequeno.  Nao se deixem levar pelas aparências: comida deliciosa , os dois funcionários extremamente simpáticos e os mojitos de blackberry divinais . A minha amiga fazia anos e qpagaram as...Mais",50,setembro de 2021,PT,Viana
"Restaurante pequeno, mas acolhedor, intimista. Comida muito boa. Comi de entrada um género de croquete de polvo, muito bom. A carne Argentina é deliciosa e muito bem servida e apresentada. Terminei com um delicioso trio de chocolate. Recomendo.",40,fevereiro de 2020,PT,Viana
"Ambiente agradável, comida deliciosa tempero na medida e o mojito...Só provando pra saber!!! Amei, super indico.",50,março de 2020,PT,Viana
"Em duvida no trip entre o Viana e outra casa de tapas, escolhemos a casa de tapas. Fila à porta, olhamos para o outro lado da rua e... estava destinado lá ir jantar. O melhor restaurante das férias.",50,fevereiro de 2020,PT,Viana
"Visitamos o restaurante em novembro de 2018 e adoramos, ficou marcado na nossa memória pelos drinks diferenciados e excelente gastronomia. Voltamos este ano com um casal de amigos que também adoraram. O atendimento é ótimo, nos sentimos em casa em ambas as vezes. O restaurante...Mais",50,fevereiro de 2020,PT,Viana
"Atendimento excelente! 
Comida saborosa, uma das melhores de Barcelona!
Já voltei duas vezes para repetir e privar outros pratos do menu que nunca desaponta.",50,janeiro de 2020,PT,Viana
"A melhor comida de Barcelona! Sem dúvida! Experimentamos quase todo o menu! O mojito de amora, absolutamente delicioso. As tapas, divinais. E o prato de carne absolutamente saboroso.",50,janeiro de 2020,PT,Viana
"Fomos muito bem recebidos pelo Miguel, atendimento perfeito, entradas e e prato principal sugeridos maravilhosos, lugar super aconchegante.",50,janeiro de 2020,PT,Viana
Top. Recomendo. Comemos Paella é uma carne Argentina. Ambos para 2 pessoas. As porções são generosas. Preço justo.,50,janeiro de 2020,PT,Viana
"Que pequeno almoço tão bom e saudável!

Sumos naturais super frescos e saborosos, comida com sabor e quantidade muito boa. Espaço lindo e bastante original, muito zen.

Staff muito muito muito simpático! 

Adorei, vou voltar e recomendo!",50,janeiro de 2023,PT,Billy Brunch & Garden
"Serviço ótimo, pessoal simpatiquíssimo! Gostei muito da comida! Rápido, saboroso, saudável! Vale a pena visitar!",50,dezembro de 2022,PT,Billy Brunch & Garden
"nunca havia comido brunch antes e foi uma experiencia muito legal... produtos da melhor qualidade, atendimento muito bom",50,julho de 2022,PT,Billy Brunch & Garden
"Tudo nesse restaurante é bom: sou sempre bem atendida, como bem e saio satisfeita. Recomendo os eggs benedict, o english breaskfast e o açai. Mas tudo é uma delícia lá!",50,julho de 2022,PT,Billy Brunch & Garden
"Billy Brunch tem opções incríveis para um brunch incrível. Toda a comida estava deliciosa e saborosa. Além da qualidade da comida, todos os atendentes são amigáveis e nos recebem muito bem. Sempre oferecem o melhor atendimento, prezando pela experiência do cliente. O ambiente do Billy...Brunch & Garden é maravilhoso também, com muitas árvores e uma vista muito boa.Mais",50,maio de 2021,PT,Billy Brunch & Garden
"Ótimo ambiente, atendimento muito bom e comida de qualidade. Um bom restaurante para ir com a família. A relação custo x benefício é boa. Há um cardápio variado de massas, carnes, frutos do mar e uma boa carta com Valpolicella Clássico dentre outros rótulos. Cerveja,refrigerantes...e sucos também de qualidade.Mais",50,janeiro de 2023,PT,Paisano Bistro
"Almoçamos no Paisano...lasanha de carne, ravioli e espaguete carbonara...Deliciosos..atendentes atenciosos!!",50,janeiro de 2023,PT,Paisano Bistro
"Tudo perfeito. 4 dias em Barcelona em Barcelona e o melhor restaurante onde fomos foi um italiano. Massa perfeita, pizza igual. Atendimento espetacular.",50,setembro de 2022,PT,Paisano Bistro
"Muito bom! 
Comida excelente , preços acessíveis e o atendimento muito bom.
Localização ótima. Recomendo imenso!!!!!",50,setembro de 2021,PT,Paisano Bistro
"Ótima opção de almoço, comida muito saborosa e um atendimento excepcional. Pedimos a lasanha do dia e estava deliciosíssima.",50,dezembro de 2019,PT,Paisano Bistro
"Fui ao Paisano na hora do almoço, antes da visita à Basílica da Sagrada Família, e foi a melhor escolha: pela localização, atendimento e sabor. A Lasanha à bolonhesa é deliciosa. Recomendo!",40,outubro de 2019,PT,Paisano Bistro
"Espaço pequeno porém aconchegante, limpo e organizado. Atendimento extremamente simpático e eficiente. Comida maravilhosa, especialmente o pan com tomate e a lasanha. Voltarei sempre!",50,outubro de 2019,PT,Paisano Bistro
"Melhor restaurante familiar de comida italiana! A lasanha é muito deliciosa. As bruschettas, como entrada, são imperdíveis, sensacionais demais. Atendimento cuidadoso, simpático e muito hospitaleiro. Difícil foi querer sair do ambiente que te deixa super confortável. 
Super recomendo.",50,outubro de 2019,PT,Paisano Bistro
"Uma cafeteria fofa! Familiar, com atendimento espetacular! A comida nem se fala... comemos uma burrata e almôndegas... ambas com ingredientes frescos e saborosos! Recomendo de olhos fechados!",50,setembro de 2019,PT,Paisano Bistro
"Por sorte tive que esperar para entrar na Sagrada Familia e fui comer no Paisano Cafe. O atendimento foi excelente, ambiente ótimo e QUE lasanha!! Certamente entrou pra lista de melhores que já comi!",50,fevereiro de 2019,PT,Paisano Bistro
"Lugar lindo , super aconchegante, atendimento maravilhoso e comida DIVINA!!!Uma ótima opção em Barcelona",50,janeiro de 2019,PT,Paisano Bistro
"Após a visita à Sagrada Família, uma excelente refeição. Tudo gostoso - desde o pão até o café. A lasanha é perfeita. O atendimento impecável. Tem wifi. Me ajudaram a pedir um táxi. Recomendo.",50,setembro de 2018,PT,Paisano Bistro
Excelente atendimento e boa comida. Bom para variar das comidas da redondeza que não são nada de especial.,40,agosto de 2018,PT,Paisano Bistro
"Comida maravilhosa,atendimento excelente!!

Um lugar do lado da Sagrada Família, não deixem de experimentar a lasanha. É TOP!!!",50,maio de 2018,PT,Paisano Bistro
"Excelente custo beneficio! Procurávamos um restaurante próximo a Sagrada Família e tivemos a grata satisfação de encontrar este local ! Atendimento acima da média ! O dono do restaurante foi muito gentil e simpático, tornando nosso almoço muito especial e nos dando um licor como...Mais",40,abril de 2018,PT,Paisano Bistro
"Ambiente agradável e atendimento muito bom! Parei apenas para um café, enquanto aguardava o horário de visita à Sagrada Familia. Mas certamente voltarei para uma refeição.",40,março de 2018,PT,Paisano Bistro
Espaço pequeno mas de enorme qualidade. Comida muito bem confeccionada e de sabor memorável. Recomenda-se!,50,janeiro de 2018,PT,Paisano Bistro
"Excelente para quem viaja só ou em grupo, lugar agradável e funcionários muito simpáticos, principalmente para quem está pelas redondezas da Sagrada Família.",50,janeiro de 2018,PT,Paisano Bistro
"Lugar simples, acolhedor. O pessoal, muito simpático e atencioso. Comidinha boa e atendimento muito bom. Valeu a pena!",50,julho de 2017,PT,Paisano Bistro
"Café Italiano...mesinhas na calçada.
Atrás da Sagrada Família.
Sem frescura ;)
Recomendo...Caprese Salada e a Lasanga.",50,julho de 2017,PT,Paisano Bistro
"Comida preparada com muito cuidado, com ingredientes frescos, boa quantidade e saborosa;  atendimento muito gentil.",50,dezembro de 2022,PT,Gusto
"Excelente serviço, noite perfeita, comida sensacional! Me senti como se tivesse na Itália. Obrigada Renato por nos fazer sentir tão em casa ❤️ Abraços do Brasil 🇧🇷",50,novembro de 2021,PT,Gusto
"Pedimos a “fogaça”, que é uma pizza com uma burrata, rúcula e jamón ibérico, excelente! 

Os preços estão na média de restaurantes do mesmo nível, recomendo.",50,agosto de 2019,PT,Gusto
"Cheguei ao restaurante, e ao entrarmos, fomos imediatamente escorraçados para a rua quase como cães, mesmo tendo reserva!!! Total falta de educação... nem jantamos... simplesmente seguimos para outro restaurante!!!",10,agosto de 2017,PT,Gusto
Maravilhoso prato Linguine com frutos do mar! A apresentação do prato é linda ! Parabéns recomendo ! Sai do restaurante com a sensação de muito feliz por ter comido esse prato ! RECOMENDO,50,julho de 2017,PT,Gusto
"Massa deliciosa, com sabor incrível e pizzas feitas em forno a lenha. Atendimento excelente com opção de ficar embaixo ou no andar de cima.",40,junho de 2017,PT,Gusto
Sensacional.... risoto de funghi  perfeito... atendimento muito bom... gnochi de gorgonzola muito bom também... recomendo!!!!,50,janeiro de 2017,PT,Gusto
"Tínhamos pesquisado restaurantes próximos as hotel e vimos que o Gusto era muito bem avaliado. Como estava a uma quadra do hotel, acabamos indo duas vezes e só não fomos outras, porque não tínhamos mais tempo e queríamos conhecer outros restaurantes. O Gusto tem uma...variedade de pratos excelente e atende vários gostos. Jantamos um dia massa e frutos do mar e no outro pizza. Dois momentos excelentes, regados a bons vinhos. Atendimento personalizado pelo proprietário.Mais",50,fevereiro de 2016,PT,Gusto
"Perfeito! Um restaurante simples porém tem tudo de bom: prato, localização, atendimento e preço! Vale a pena conferir.",50,fevereiro de 2016,PT,Gusto
"Se você procurar, pelo letreiro, pelo Restaurante Gusto, não o encontrará, com certeza. Na porta estará TRATTORIA GUSTO. Não importa. Seja lá o nome que ali esteja você será bem tratado.
As ordens do possível patrão para os seus funcionários são em espanhol e, para...pelo menos dois, são em italiano, dando a impressão que são seus filhos (garçons também, ""na luta"" como os outros).
O menu é variado, mas opte (se você estiver a fim de economizar) pelo Menu Gusto. Para cada pessoa sai por 12,90 euros com direito a sobremesa e uma taça de vinho e você opta por quatro pratos disponíveis. 
Possuem eles o primeiro e o segundo prato. Não precisa dos dois, até porque você pagará mais caro e não vai aguentar comer tanto.
Atenção: o prato não pode ser dividido e você tem está acompanhado tem de pedir o prato do (ou da) seu (ou sua) acompanhante.
Optei pelo risoto de frutos de mar (imperdível). Mas se você não gosta de frutos do mar, pode optar pelas massas. Não vai se arrepender também.Mais",50,janeiro de 2016,PT,Gusto
"Desde o local central, staff muito atenciosos, banheiros limpos, menu bem variado.
Pedimos de entrada salada e tartar. Melhor q já comi. Depois massas ao sugo e risoto trufado com trufas negras raladas, q delicia!!!! Era tanta comida q nem conseguimos provar as sobremesas q...Mais",50,setembro de 2015,PT,Gusto
"Chegamos de Paris e ja era tarde quando entramos no restaurante. Estavam quase fechando, mas ao falar que éramos brasileiros, levantou-se de uma única mesa que tinha gente, o Sr. Mário, italiano, muito simpático, que ja morou no Brasil, mandou que nos sentássemos e escolhêssemos...Mais",50,setembro de 2013,PT,Gusto
"Eu e minha esposa comemos uma excelente pizza capricciosa, a qual dividimos, pois vimos que era farta e sabemos que comemos pouco.

O serviço é atencioso e educado.

Entendo que o preço é justo para o que se oferece. Nossa conta totalizou cerca de 35...Mais",50,maio de 2013,PT,Gusto
"Muito boa pizza da próxima vez, experimente outros pratos. O serviço foi excelente e uma atmosfera excelente. Pensando em voltar em breve",50,outubro de 2020,PT,Gusto
"Refeição e serviço brilhante!

Massas e pizzas (napoli) verdadeiramente autênticas.

O Linguine all 'Astice é incrível junto com o refogado' di vongole!

E a base da pizza é como se você a pedisse de Napoli - cozida em forno de pizza a lenha com aquela...base extraordinária e mastigável. YUM!

Gusto é o nosso ""favorito"" quando estamos ansiosos por italiano.

E, diabos, se é bom o suficiente para Beyoncé, é bom o suficiente para nós!Mais",50,setembro de 2020,PT,Gusto
"Refeição incrível - equipe super agradável, muito envolvente, todos da Itália. . . . O burrata, berinjela parmesão e carpaccio de carne foram surpreendentes. . o risoto de legumes foi o melhor que eu já tive. . . todos adoraram suas massas e pizza. ..... A qualidade foi incrível e por isso foram os preços! ! !Mais",50,janeiro de 2020,PT,Gusto
"Jantamos no Gusto na noite final do nosso cruzeiro pelo Mediterrâneo. A comida e serviço foram excelentes. Nós éramos uma festa de 11 e eles nos acomodaram lindamente. Tivemos pizza, risoto, lasanha, salada Caesar e muito mais. Também tivemos várias garrafas de excelente vinho. Tudo...em todos uma noite encantadora.Mais",50,janeiro de 2020,PT,Gusto
"Na última quinta-feira, voltei de Boston para casa em uma enorme tempestade de neve. Quando cheguei em Barcelona, disse a meu marido que estava cansado demais para cozinhar. Ele sugeriu que experimentássemos a pizza
coloque GUSTO na esquina do nosso apartamento. Lá fomos nós. Quando...chegamos, o lugar estava vazio. Meu marido solicitou a pizza de 4 queijos e uma garrafa de água mineral.
Eu pedi a pizza de cogumelos e pedi um copo de água da torneira. O enfraquecedor disparou! ! Ele me disse sarcasticamente que eles não servem água da torneira. Eu disse a ele que moro em Barrcelona por 3 anos. Escovo meus dentes diariamente com ele e bebo todos os dias e estou com excelente saúde. Ele disse algo rude em Sanish e meu marido, sendo espanhol, falou com ele. Para seu crédito, o garçom pede desculpas, mas isso arruinou o jantar inteiro. Minha sugestão para a Mercadon comprar uma pizza congelada por 3 euros, vou ter melhor qualidade e sabor. Nossa conta chegou a 35 euros por 2 pizzas uma água e um deserto. Minha sugestão, se você quiser italiano de verdade, vá ao Greco. Pode custar mais, mas vale a pena. Ship Gusto.Mais",10,dezembro de 2019,PT,Gusto
"Lugar muito quente e agradável. Melhor pizza. Eu tinha o calzone com queijo e presunto por dentro e por fora. A equipe foi ótima, especialmente o servidor Dario!Mais",50,dezembro de 2019,PT,Gusto
"Fui com meus amigos ao restaurante e adoramos! ! A comida é incrível, bom lugar para estar com amigos ea equipe foi super agradável e amigável! ! Eu vou lá mais vezes com certeza! !",50,maio de 2019,PT,Gusto
"Fomos tomar um brunch e saímos de estomago feliz! 

Espaço giro, atendimento muito bom e com esplanada.

Relativamente à comida, gostámos muito mas numa escala de 0-10 seria um 7 uma vez que ainda há alguns aspetos que têm de melhorar.

Eramos 4, comemos bastante...e pagámos 20€ cada!Mais",50,dezembro de 2022,PT,Cremat 11
"Uma delícia de brunch, atendimento cuidadoso! Os pratos são bem servidos e deliciosos. Adorei o ambiente aconchegante e a decoração intimista. Vale muito a pena conhecer!
Achei a decoração dos pratos incrível ! Dá para perceber claramente o carinho e cuidado na elaboração! Parabéns! Me...surpreendeu muito positivamente. Certamente vou voltar !Mais",50,novembro de 2022,PT,Cremat 11
"Bom, mas nada demais! 
Fomos comer brunch e quando chegamos tinha uma filhinha, porque o lugar é famosinho no Instagram então esperamos tranquilamente! 
O ambiente é de fato lindo, mas senti que se esforçaram só no ambiente e no resto não kkkk 
A comida estava...boa, mas nada super incrível como achei que seria.Mais",40,fevereiro de 2022,PT,Cremat 11
"Melhor panqueca dos últimos 10 anos, vale muito apena ir . Atendimento muito amigavel, local muito bom. Nota 10",50,dezembro de 2019,PT,Cremat 11
"Um charme o lugar, atendimento excelente e comida deliciosa. 
Fica numa rua ao lado do Museu Picasso. 
Fomos almoçar e descobrimos que a especialidade do lugar é brunch, mas comemos super bem e amamos. 
Recebemos tanta atenção no atendimento que nos foi sugerido um lugar...para comer o melhor churros de Barcelona - Xurreria San Román. Fomos e amamos tb.Mais",50,outubro de 2019,PT,Cremat 11
Esta pequena jóia escondida foi fantástica. Nós viemos para o brunch e só tivemos que esperar 15 minutos por uma mesa que era boa. Comemos a linguiça catalã com batatas e o bife que também vinha com molho holandês e os ovos pochê do prefeito....O garçom foi muito simpático e prestativo.Mais,50,agosto de 2020,PT,Cremat 11
"Cremat 11 foi um delicioso saciador do apetite. Mesmo nos bairros góticos, a comida era deliciosa, juntamente com uma configuração pitoresca. Nós nos apaixonamos pelas panquecas e os funcionários eram adoráveis. É imperdível para o brunch e as panquecas são uma das melhores que já...comi por um tempo. O chá Nuit foi uma explosão esplêndida de sabores de frutas na boca também. Um deve ir! FelicidadesMais",50,julho de 2020,PT,Cremat 11
"Essas panquecas! Nossa minha panqueca de maracujá foi a melhor, adorei. Definitivamente, recomendo este lugar Fizemos uma reserva, pois li em outros comentários que não há muito espaço e eu sugiro que você faça o mesmo. Então você tem certeza de que tem um lugar...neste ótimo restaurante. Não consegui terminar minhas panquecas e depois de pedir, poderia levar o que sobrou para casa. Meu namorado também gostou muito das panquecas de banana dele e até o chá (também com maracujá) era especial e adorável. Posso voltar agora?Mais",50,julho de 2020,PT,Cremat 11
"Peguei panquecas de banana e maracujá, a torrada de abacate estava muito boa e as panquecas foram as melhores de todos os tempos:)) O material é amigável",50,julho de 2020,PT,Cremat 11
"Brunch incrível! Tive as panquecas de banana, que eram tão boas. Também posso recomendar os mojitos de mirtilo. Os garçons foram gentis e atenciosos. Situa-se numa rua calma",50,julho de 2020,PT,Cremat 11
"Viemos para o Cremat 11 para tomar um brunch e foi uma experiência incrível! A comida é deliciosa, os coquetéis são ótimos, o ambiente é bom e as coisas são amigáveis. Além disso, você precisa experimentar panquecas. Altamente recomendado!",50,julho de 2020,PT,Cremat 11
"Eu estava com meu irmão em busca de um bom brunch para comemorar nossa primeira viagem a Barcelona e escolhi o Cremat 11! E era um lugar TÃO adorável! Não é um menu grande, mas tudo que você precisa para um bom brunch. Levamos torradas...de abacate com bacon extra e as mais perfeitas Panquecas de banana! Agulhas para dizer que estava delicioso?
O Serviço foi tão querido! Ele até nos deu alguns conselhos durante a nossa estada em Barcelona!

Espero visitá-los novamenteMais",50,julho de 2020,PT,Cremat 11
lugar fabuloso. É OBRIGATÓRIO visitar para tomar uma boa xícara de café frio e saborosas panquecas de banana com calda de suor. Tudo em uma escolha superior.,50,julho de 2020,PT,Cremat 11
"Cremat 11 é um pequeno tesouro escondido no centro de Barcelona que encontramos procurando um local para brunch. Nós amamos em todos os sentidos, o ambiente descontraído, o garçom amigável e, claro, a comida incrível.
 - Panquecas de banana e Ovos Benedict - Não diga...mais nada!
Delícias de outro mundo!
Altamente recomendadoMais",50,junho de 2020,PT,Cremat 11
A oferta de brunch + cava de hoje foi a surpresa mais saborosa para mim e meu parceiro. Um dos serviços mais gentis que recebemos em Barcelona e os pratos estavam simplesmente perfeitos. Obrigado e estaremos de volta!,50,junho de 2020,PT,Cremat 11
Foood incrível! ! Nós amamos o serviço e as pessoas foram muito simpáticas e prestativas. Cava ilimitado foi incrível! ! !,50,junho de 2020,PT,Cremat 11
"Ontem foi a reabertura do Cremat e estávamos ansiosos para voltar! como normalmente era um ótimo ambiente, bons coquetéis e comida saborosa.",50,junho de 2020,PT,Cremat 11
