review,rating,date,language,restaurant
"Eu me sinto tão abençoada, encontrei este lugar. Isso é outra coisa. As pessoas que trabalham lá são gênios. Eles criam a melhor comida que já comi. Para todos os amantes de abacate, bacon e panqueca - este é o lugar para estar. Definitivamente visitar...este lugar mágico novamente, quando eu estiver em Barcelona novamente ??Mais",50,janeiro de 2020,PT,Cremat 11
"Minhas maiores recomendações! Você realmente precisa vir aqui para desfrutar de um ótimo brunch durante a sua estadia em Barcelona! Você não vai se arrepender? Estivemos lá em março duas vezes - na verdade, salvamos o cartão “por favor, avalie-nos - que recebemos, só porque...eu realmente queria dar uma recomendação a este lugar! Uma dica: chegue a tempo porque está muito ocupado, grandes filas de clientes esperando desde o início para abrir as portas!

Este lugar era tão bom que esperar pela segunda vez valeu muito a pena!

Infelizmente não posso enviar meus ótimos vídeos da comida, mas vou adicionar algumas fotos para vocês.

Você adora comida? Então você realmente precisa visitar este lugar! ?? Com certeza irei visitar este lugar novamente na minha próxima vez em Barcelona e gostaria que tivéssemos algo semelhante em Gotemburgo ???Mais",50,março de 2020,PT,Cremat 11
"Este lugar é uma linda jóia escondida. Fomos para o brunch, tivemos haveos rancheros e torradas de abacate e o melhor café desde que chegamos à Espanha. Eles então nos deram um voucher para voltar para jantar uma noite e, como tínhamos apenas um dia...inteiro, decidimos voltar no mesmo dia para o jantar.

O jantar e coquetéis foram INCRÍVEIS. Tínhamos quase todos os itens principais e meu marido até pediu um segundo polvo que era bom. Amei o cocktail de joelhos de abelhas e a sangria branca.

Chef adorável e tão bom poder ver seu trabalho! Nossas garçonetes de manhã e à noite também adoráveis!Mais",50,outubro de 2019,PT,Cremat 11
"Hamburguesa 100% perfeita, local muito limpo e um atendímento  de alta qualidade  en Barcelona....    Os indico, obrigado",50,fevereiro de 2021,PT,b Restaurant
"Eu avalio este restaurante coma melhor nota de Barcelona, gostei mesmo. Venha provar uma hamburguesa especial.",50,fevereiro de 2021,PT,b Restaurant
"Excelente comida em uma ótima atmosfera, o que você quiser em um hambúrguer, os melhores hambúrgueres que já tivemos. Funcionários atenciosos e muito agradáveis, definitivamente vale a pena uma visita.",50,dezembro de 2019,PT,b Restaurant
"Nós estávamos perdendo ser Hambúrguer, entretanto percebeu que seja Restaurante é o MESMO só maior e em outro local.
Hambúrgueres são surpreendentes! ! ! Sem dúvida os melhores em Barcelona. Também as batatas fritas e sobremesas! A equipe é tão simpática e bons preços.
Totalmente...recomendado! ! !Mais",50,janeiro de 2019,PT,b Restaurant
"Nós éramos um grupo de 6 amigos (3 casais) em nossos 30 s recuperar depois das férias de verão. Nós foram recebidos na porta por Marc, um dos proprietários eo coração e alma do renomado ""be Burger"" e também o mais recente ""be Restaurant"".

O...restaurante é muito acolhedor. Eles mostram uma grande seleção de cerveja artesanal que eles conhecem bem, então você pode pedir recomendações em caso de dúvida. Nós tivemos alguns patatas bravas para começar e eles estavam para morrer; não só porque o molho era um ""brava"" molho verdadeiramente caseiro mas porque as batatas foram preparados com perfeição pelo Chef Albert, o outro proprietário.

Como prato principal, tive a ser - Dali, um patty incrível de 150 g de carne com foie e confit cebola cozida exactamente como eu pedi. Meus amigos tentaram o ser - Pol, ser - Mozart e ser - Dolce Vita e eles estavam todos espantados com a qualidade de todos os ingredientes ea apresentação meticulosa e chapeamento. Nós terminou a refeição com sua cheesecake de chocolate branco caseiro que foi o último toque perfeito para um jantar memorável.

Nenhum de nós foi vegan ou vegetariano, mas eles oferecem uma boa selecção de hambúrgueres vegan e muitos jardim-a-mesa opções que torna o ""ser Restaurante"" realmente amigável para pessoas com necessidades dietéticas.

A localização do ""be Restaurant"" é perfeita, pois fica a apenas 5 minutos a pé da estação central de trem Sants Estaci e também fica ao lado da parada ""Enten a"" da linha de metrô azul (L 5). O bairro é descontraído, mas ao mesmo tempo cêntrico. Esta é uma ótima opção se você quiser sair depois do jantar ou se você quiser ficar na mesa apenas relaxando.Mais",50,setembro de 2018,PT,b Restaurant
Muito boa comida! Extremamente limpo restaurante com uma atmosfera amigável! Material muito útil e gentil! Totalmente proposto! ! !,50,agosto de 2018,PT,b Restaurant
"Uma experiência tão boa! Meus amigos e eu fomos para Barcelona alguns dias e encontramos este lugar, excelente atenção, melhor comida (ainda tem opções vegan!)
 A melhor parte de todas as sobremesas! Nós tentamos alguns deles e nós concordamos veludo vermelho é o melhor!
 E...totalmente acessível, todo mundo tem que vir e experimentar!Mais",50,janeiro de 2018,PT,b Restaurant
Ótima experiência com amigos! ! Lugar incrível para desfrutar de um pedaço fantástico de carne! ! Eu voltarei em breve! !,50,fevereiro de 2018,PT,b Restaurant
"Um sítio típico, rústico, mas muito bom. Atendimento local, comida saborosa. Comemos ovos rotos, um queijo com tostas, e um cheesecake muito bom. O senhor ainda nos ofereceu azeitonas, e um licor no fim. Gostamos muito!!",50,fevereiro de 2023,PT,Bar Xapako
Atendimento 5 estrelas. Dono e funcionários muito simpáticos. Bom ambiente. Tapas muito boas. Qualidade/ preço excelente.Mais,50,janeiro de 2023,PT,Bar Xapako
"Vim aqui jantar com mais 3 amigas e sem expetativas muito elevadas e fomos surpreendidas, saindo muito felizes com a nossa escolha! Não se deixem enganar pelo look mais humilde do estabelecimento.
A relação qualidade-preço foi ótima, uma vez que a comida era muito boa...e muito barata. Bebemos muito e comemos muito e pagamos cerca de 15€

O ponto mais alto do jantar foi sem duvida o atendimento! O senhor é muito querido e sempre muito preocupado com o nosso bem-estar. 

Resumindo, 5 estrelas! Havemos de voltarMais",50,dezembro de 2022,PT,Bar Xapako
"Local simples, mas com todas as qualidades que se espera de um bom restaurante. Fomos muito bem recebidos. A comida é boa, preço bom. O local é extremamente limpo, o que me chamou a atenção, sempre observo isso em qualquer lugar, seja simples ou mais...sofisticado. Não havia um cantinho que não estivesse super limpo. A limpeza e atenção mostram o cuidado dos proprietários. Comi um steak and fries com minha família. Estava muito  bom.  Voltarei mais vezes.Mais",40,janeiro de 2022,PT,Bar Xapako
"Tudo excelente! Comida muito boa, saborosa e de qualidade,  boa relação preço qualidade.  Os melhores ovos fotos que já comi! Ambiente familiar, dono muito simpático e atencioso. Recomendo!!!!",50,dezembro de 2021,PT,Bar Xapako
Comida boa!trato excelente recomendo esse lugar simples com bom gosto obrigada Paco! Vamos voltar e recomendar  os amigos,50,fevereiro de 2020,PT,Bar Xapako
"Nós estivemos no Xapakó, e tudo foi ótimo, comida muito saborosa e caseira a um preço muito razoável.
O dono, grande paco, o melhor andaluz de barcelona te trata como uma família. Raramente vc terá um trato similar em outro lugar.
Que continue assim sempre!!...A música, o bilhar e a hospitalidade!Mais",50,fevereiro de 2020,PT,Bar Xapako
"Atendimento excelente. O dono é um senhor muito atencioso, tem muita paciência pra explicar os pratos.
Comida saborosa e sempre quentinha
Preço justo.
Música apesar de mecânica, também muito agradável.
Ambiente agradável e descontraído, mesas na parte externa e interna
Super recomendo!",50,agosto de 2018,PT,Bar Xapako
"Apesar de parecer um bar qualquer ao chegar você é surpreendido com um ótimo atendimento, tudo barato e comida (tanto os pratos, tapas e bebidas) de muita qualidade e saborosa. O dono é atencioso e simpático. Tão bom que fomos pela primeira vez e voltamos...no final da viagem.  Super recomendado.Mais",50,julho de 2018,PT,Bar Xapako
"Barato e bom. Comidas locais a preço justo.  Chopp barato. Ao entrar parece um lugar estranho, mas voce é surpreendido.",50,julho de 2018,PT,Bar Xapako
"Excelente atendimento, degustação da gastronomia típica local.
Recomendado! Irei voltar certamente 👍",50,abril de 2018,PT,Bar Xapako
"Este espaço é muito simples, sem grande decoração mas o anfitrião faz a casa! Os funcionários são muito simpáticos, o atendimento é rápido, o espaço tem música mas dá para conversar, a comida é muito boa, recomendo as batatas bravas, os ovos rotos e a...Mais",50,abril de 2018,PT,Bar Xapako
"Lugar acolhedor, onde muita gente se junta para ver futebol enquanto come umas tapas e bebe umas cervejas. Atendimento sempre muito simpático. Comida simples, mas muito saborosa.",40,março de 2018,PT,Bar Xapako
"Um bar com muitos locais o que é bom, um atendimento super simpático e acolhedor, qualquer dúvida explicam tudo da melhor maneira possível, comida feita no momento e bem confeccionada, um menu com muita variedade
Obrigado !!",50,fevereiro de 2018,PT,Bar Xapako
"Comida bem feita, cerveja gelada e bom atendimento. Lugar agradável e bem decorado. Recomendo para todos",40,setembro de 2017,PT,Bar Xapako
"É um restaurante de refeições rápidas e correntes, tem pratos combinados que são aqueles que costumamos ter em Portugal isto é um prato único sem primeiros nem segundos como é habitual em Espanha. A qualidade não é famosa mas dá para ""desenrascar"" uma refeição corrente....Mais",20,agosto de 2017,PT,Bar Xapako
Melhor refeição que tivemos em Barcelona! Serviço absolutamente delicioso e incrível. Definitivamente não é para ser desperdiçada.,50,novembro de 2019,PT,Bar Xapako
"Excelente comida e bebidas, funcionários super simpáticos, excelente ambiente! O que mais você pode pedir! Altamente recomendado para quem visita Barcelona! !",50,junho de 2020,PT,Bar Xapako
"Excelente bar de tapas, com uma atmosfera muito calorosa e acolhedora. E as tapas são excelentes. Nós comemos neste conjunto duas vezes em duas semanas. Eu não posso falar o suficiente sobre as patatas bravas! Comemos patatas por toda Barcelona, e havia algo de perfeito...nesse sabor. . . . assim como minha avó catalã faria se eu tivesse uma. Sonharei com meu retorno a Barcelona para comer patatas bravas no bar xapako. Outras tapas também foram ótimas, e definitivamente recomendaria o polvo também. Definitivamente vale a pena uma parada!Mais",50,janeiro de 2020,PT,Bar Xapako
"Eu estava aqui com minha família de 7 anos. É um lugar muito aconchegante, cheio de habitantes locais, o que lhe dá uma ótima sensação de Barcelona. A comida é caseira e você obtém um ótimo valor pelo que paga. A equipe é imensamente amigável...e útil. Voltamos várias vezes dentro da nossa estadia. Altamente recomendado! ! :)Mais",50,novembro de 2019,PT,Bar Xapako
"Atendimento muito bom! Comida espetacular! Vinho bom, com preço atrativo! Recomendo muito comer aqui quando estiver passeando por Barcelona.",50,fevereiro de 2023,PT,Diegos Bar Restaurant
Comida muito boa e atendimento ainda melhor! Sangria de espumante muito boa também. Adorei e recomendo!,50,junho de 2022,PT,Diegos Bar Restaurant
"Um ótimo lugar para conhecer e apreciar as delícias de Barcelona, staff muito atenciosos e disponíveis mesmo para quem não não tem afinidade com o idioma!! Comida de ótima qualidade!!!",50,maio de 2022,PT,Diegos Bar Restaurant
"Ótimo lugar. Comida muito boa e atendimento ótimo. Preço bem justo. Vale a pena a visita e o jantar. Adoramos e se possível, voltaremos.",50,dezembro de 2019,PT,Diegos Bar Restaurant
Excelente experiência de tapas. O restaurante é bastante acolhedor e o Diego faz-nos sentir em casa. As tapas e o serviço foi do melhor que experimentamos em Barcelona a preços justos.,50,abril de 2019,PT,Diegos Bar Restaurant
"Muito bom o proprietário um jovem que super educado e ainda fala português fluente, lugar é pequeno mas aconchegante e comida ótima com preço excelente. Recomendo para um jantar informal.",40,novembro de 2018,PT,Diegos Bar Restaurant
"Excelente restaurante, comida super saborosa e honesta, ambiente tranquilo que não parece que estamos em Barcelona!
Preço justo, recomendo!",50,julho de 2018,PT,Diegos Bar Restaurant
Excelente paella e carne. Tapas fantásticas. Vinhos deliciosos. Bom serviço. Tudo em um ambiente aconchegante e a preços razoáveis.,50,março de 2020,PT,Diegos Bar Restaurant
"Fiquei no Catalonia Artenas ao virar da esquina.
Pedimos recomendações aos funcionários do hotel, mas eles nos direcionaram para o centro da cidade.
Uau, andamos pela estrada para encontrar este ótimo restaurante.
Vinhos adoráveis e bate-papo amigável.
De volta amanhã, pensamos! !",50,janeiro de 2020,PT,Diegos Bar Restaurant
"Os garçons são muito simpáticos e a comida extraordinária. O melhor restaurante de tapa em Clot.
Altamente recomendado!",50,outubro de 2019,PT,Diegos Bar Restaurant
"isso é uma experiência para todos. nós, americanos, almoçamos de manhã. vimos a placa para um café da manhã americano em frente à loja em um longo dia de caminhada. decidimos ir na manhã seguinte. assumindo que eles estariam abertos, eles foram fechados às 9:00....nada demais. voltou no dia seguinte às 11 e eles estavam fechados. então fomos às 20:00 da noite seguinte, wala, eles estavam abertos. nós apreciamos bebidas e cozinha leve. as bebidas eram fantásticas e a comida deliciosa. foi tão agradável, voltamos na noite seguinte apenas para bebidas. Diego é um trabalhador esforçado e parece realmente gostar de seu ofício.Mais",50,setembro de 2019,PT,Diegos Bar Restaurant
"Isso foi ao virar da esquina do nosso hotel, então pensamos em dar e ir e foi ótimo. Nós fomos cerca de 21:00 e estava quieto, mas logo cheio. A comida e o vinho eram ótimos e o proprietário (Diego) estava à disposição para conversar...e recomendar um pouco de vinho. Nós realmente apreciamos a nossa noite e definitivamente voltaria se passarmos por este caminho novamenteMais",40,julho de 2019,PT,Diegos Bar Restaurant
"Tivemos um ótimo jantar no restaurante Diegos ontem à noite. A comida estava absolutamente deliciosa? Serviço foi de primeira classe. Duran, proprietário, foi tão atenta para nós e outros clientes. Preço era muito razoável.

Foi o nosso melhor jantar em Barcelona! Nós definitivamente voltamos para...jantar em Diegos quando visitarmos Barcelona no futuro.Mais",50,junho de 2019,PT,Diegos Bar Restaurant
"Você não vai encontrar uma frente de loja de fantasia ou interior elegante, mas a comida foi excelente ea equipe inigualável em seu atendimento ao cliente. Nós catalãs iam aqui a primeira noite em Barcelona porque foi perto do hotel e que uma agradável surpresa....As tapas e sangria estavam deliciosos. Nosso garçom foi além amigável, não se lembra do seu nome e nunca pediu a sua posição no restaurante, mas se ele não era o proprietário, talvez ele deveria ser. Tão delicioso e agradável, voltamos para o jantar a nossa última noite também.Mais",50,junho de 2019,PT,Diegos Bar Restaurant
"Eu parei por este restaurante por acaso para um almoço tardio, e desfrutei minhas tapas. Os destaques foram os croquetes de cogumelos caseiros deliciosos - os melhores croquetas que eu já provei. O serviço foi excelente e eu me senti muito bem-vindo como um viajante...individual. Gostaria de recomendar se você está procurando um lugar simples com comida caseira e não são muito com muita pressa sobre a decoração simples.Mais",50,março de 2019,PT,Diegos Bar Restaurant
"Great encontrar perto da estação de metrô Clot! Fui atraído para o lugar pela classificação positiva e não fiquei desapontado a todos, a tal ponto que eu voltei para jantar três dias seguidos. Toda vez fomos esperados pelo próprio Diego e um colega, dois gentis...gentis e amigáveis. Alimentos foi impecavelmente apresentados e Experimentado delicioso (do croquetes ao polvo, o camarões e sobremesas), como o cortesia ervas licor nós oferecidos no final de nossa refeição.
Este restaurante acolhedor e decorado com bom gosto pode acomodar mais de 20 clientes.Mais",50,fevereiro de 2019,PT,Diegos Bar Restaurant
"Almoçamos neste pequeno restaurante não muito longe da Sagrada Família, para começar nossas férias no BCN e foi uma ótima escolha! O lugar em si não é enorme, e por isso é tranquilo e práctica, com a equipe extremamente gentil e feliz. Tentámos tapas típicas,...paella e sobremesas locais e tudo foi ESPECTACULAR.
Importante: TENTE SUA SANGRIA! você vai amar! !Mais",50,dezembro de 2018,PT,Diegos Bar Restaurant
"Tivemos um grupo de 12 a pé e Diego se sentou e esperou-nos bem. Ele era um cavalheiro tão maravilhoso e extremamente amigável. Tivemos tapas e paella e também o prato de frango com curry. Um prato era melhor que o outro. A sangria foi...fabulosa, bem como os mojitos. Se você está procurando um restaurante local com boa comida autêntica, não deixe de conhecer o Diego! ! ! !Mais",50,outubro de 2018,PT,Diegos Bar Restaurant
Lugar pitoresco pequeno. Equipe simpática e atenciosa. A salada de queijo de cabra com um molho de mostarda balsâmico e regados com um molho de framboesa é excelente. Provavelmente o melhor que eu já tive. as nozes também adicionam o crunch perfeito. O bife solomilo...servido com batata frita e pimientos del padron também foi excepcional. Muito satisfeito com a noite.Mais,40,setembro de 2018,PT,Diegos Bar Restaurant
"Um pequeno restaurante fantástico de bar com uma equipe muito simpática.
Alimentos foi excelente. Temos a salada de queijo de cabra, o entrec te e a lula frita.
A salada de queijo de cabra absolutamente roubou o show. Foi provavelmente a melhor salada que eu...já provei na minha vida.
Uma ótima maneira de terminar a nossa última noite em Barcelona.Mais",50,maio de 2018,PT,Diegos Bar Restaurant
"Excelente local para refeições, bons vinhos, cervejas gelada! Destaque especial para a Salada Ceaser. Atendimento especial pelo proprietário IMO. 
Voltaresmos!",50,agosto de 2022,PT,Bella Venezia
"Muito bom!! Comemos pizzas muito boas, até mesmo a massa com um serviço muito amigável e muito bom, estaremos de volta, muito obrigado",50,julho de 2022,PT,Bella Venezia
"A comida é muito saborosa. Nós pedimos pizzas e massas, estava tudo excelente. E o atendimento é ótimo! Daniel nos atendeu super bem, muito simpático e divertido. Foi uma noite muito agradável.",50,julho de 2022,PT,Bella Venezia
